id	name	type	url	description
393309	Rachel	Q1114461	https://anilist.co/character/393309	蕾切. Character in Du Zhuansheng Le, Wo Cai Buyao Zai Gei Ni Bumo!
393310	Xiya Lin	Q1114461	https://anilist.co/character/393310	林曦雅. Character in Du Zhuansheng Le, Wo Cai Buyao Zai Gei Ni Bumo!
393318	Uka no Haha	Q80447738	https://anilist.co/character/393318	羽花の母. Character in Honey Lemon Soda
393319	Kenjitsu Ishimori	Q80447738	https://anilist.co/character/393319	石森堅実. Character in Honey Lemon Soda
393320	Natsumi	Q80447738	https://anilist.co/character/393320	菜摘. Character in Honey Lemon Soda
393321	Nagano	Q80447738	https://anilist.co/character/393321	永野. Character in Honey Lemon Soda
393322	Seki	Q80447738	https://anilist.co/character/393322	関. Character in Honey Lemon Soda
393324	Kamakiri	Q80447738	https://anilist.co/character/393324	カマキリ. Character in Honey Lemon Soda
393325	Asumi	Q80447738	https://anilist.co/character/393325	明日美. Character in Honey Lemon Soda
393326	Miru	Q80447738	https://anilist.co/character/393326	ミル. Character in Honey Lemon Soda
393327	Yukino	Q80447738	https://anilist.co/character/393327	雪乃. Character in Honey Lemon Soda
393329	Mikarin	Q80447738	https://anilist.co/character/393329	みかりん. Character in Honey Lemon Soda
393330	Abe-sensei	Q80447738	https://anilist.co/character/393330	阿部先生. Character in Honey Lemon Soda
393331	Tonbo	Q80447738	https://anilist.co/character/393331	トンボ. Character in Honey Lemon Soda
393332	Kaede	Q80447738	https://anilist.co/character/393332	Character in Honey Lemon Soda
393333	Ayaka	Q80447738	https://anilist.co/character/393333	彩香. Character in Honey Lemon Soda
393334	Momo	Q80447738	https://anilist.co/character/393334	桃. Character in Honey Lemon Soda
393335	Midori-sensei	Q80447738	https://anilist.co/character/393335	緑先生. Character in Honey Lemon Soda
393336	Yasushi	Q80447738	https://anilist.co/character/393336	やすし. Character in Honey Lemon Soda
393337	Kiyoshi	Q80447738	https://anilist.co/character/393337	きよし. Character in Honey Lemon Soda
393339	Musashi Furuichi	Q80447738	https://anilist.co/character/393339	古市武蔵. Character in Honey Lemon Soda
393343	Touya	Q87576284	https://anilist.co/character/393343	冬夜. Character in Anyway, I'm Falling in Love with You.
393344	Amon Hiratsuka	Q87576284	https://anilist.co/character/393344	平塚亜門. Character in Anyway, I'm Falling in Love with You.
393348	Misao Tsukinoki	Q3658341	https://anilist.co/character/393348	槻ノ木操. Character in The Mimosa Confessions
393349	Arata Tsukinoki	Q3658341	https://anilist.co/character/393349	槻ノ木新. Character in The Mimosa Confessions
393350	Yuki Tsukinoki	Q3658341	https://anilist.co/character/393350	槻ノ木雪. Character in The Mimosa Confessions
393354	Jun Yu	Q1114461	https://anilist.co/character/393354	유준. Character in Dancer
393355	Jae-Ho Choi	Q1114461	https://anilist.co/character/393355	최재호. Character in Dancer
393356	Seung-Hak Yeo	Q1114461	https://anilist.co/character/393356	여승학. Character in Dancer
393359	Himuro	Q80447738	https://anilist.co/character/393359	氷室. Character in Sora wa Akai Kawa no Hotori
393361	Dahaka Azi	Q80447738	https://anilist.co/character/393361	ダハーカ. Character in The Demon King's Daughter is Too Kind!!
393362	Onna no Ko	Q80447738	https://anilist.co/character/393362	女の子. Character in The Demon King's Daughter is Too Kind!!
393363	Kodomo	Q80447738	https://anilist.co/character/393363	子供. Character in The Demon King's Daughter is Too Kind!!
393367	Chou Kuroyanagi	Q80447738	https://anilist.co/character/393367	黒柳朝. Character in Chocchan Monogatari
393368	Moritsuna Kuroyanagi	Q80447738	https://anilist.co/character/393368	黒柳守綱. Character in Chocchan Monogatari
393369	Tetsuko Kuroyanagi	Q80447738	https://anilist.co/character/393369	黒柳徹子. Character in Chocchan Monogatari
393370	Meiji Kuroyanagi	Q80447738	https://anilist.co/character/393370	黒柳明児. Character in Chocchan Monogatari
393371	J	Q80447738	https://anilist.co/character/393371	ジェイ. Character in JM
393372	Megumi	Q80447738	https://anilist.co/character/393372	恵. Character in JM
393373	Noriaki Kuroyanagi	Q80447738	https://anilist.co/character/393373	黒柳紀明. Character in Chocchan Monogatari
393374	Terada	Q80447738	https://anilist.co/character/393374	寺田. Character in Chocchan Monogatari
393375	Nakano	Q80447738	https://anilist.co/character/393375	中野. Character in Chocchan Monogatari
393376	Isha	Q80447738	https://anilist.co/character/393376	医者. Character in Chocchan Monogatari
393377	Joukan	Q80447738	https://anilist.co/character/393377	上官. Character in Chocchan Monogatari
393378	Jokyoushi	Q80447738	https://anilist.co/character/393378	女教師. Character in Chocchan Monogatari
393379	Seitotachi	Q80447738	https://anilist.co/character/393379	生徒たち. Character in Chocchan Monogatari
393380	Kobayashi Kouchou	Q80447738	https://anilist.co/character/393380	小林校長. Character in Chocchan Monogatari
393381	Chuunen Onna	Q80447738	https://anilist.co/character/393381	中年女. Character in Chocchan Monogatari
393382	Yaoya	Q80447738	https://anilist.co/character/393382	八百屋. Character in Chocchan Monogatari
393383	Seitotachi	Q80447738	https://anilist.co/character/393383	生徒たち. Character in Chocchan Monogatari
393384	Seitotachi	Q80447738	https://anilist.co/character/393384	生徒たち. Character in Chocchan Monogatari
393385	Seitotachi	Q80447738	https://anilist.co/character/393385	生徒たち. Character in Chocchan Monogatari
393386	Chou no Haha	Q80447738	https://anilist.co/character/393386	朝の母. Character in Chocchan Monogatari
393387	Chou no Chichi	Q80447738	https://anilist.co/character/393387	朝の父. Character in Chocchan Monogatari
393388	Noda	Q80447738	https://anilist.co/character/393388	野田. Character in Chocchan Monogatari
393407	Zhi Tang	Q15711870	https://anilist.co/character/393407	汤直. Character in Tang Zhi Zhi Yi
393410	Zhu Jingling	Q15711870	https://anilist.co/character/393410	竹精灵. Character in Tang Zhi Zhi Yi
393411	Longnü	Q15711870	https://anilist.co/character/393411	龙女. Character in Tang Zhi Zhi Yi
393420	Annai Kikai	Q80447738	https://anilist.co/character/393420	案内機械. Character in Kino's Journey
393421	Otoko	Q80447738	https://anilist.co/character/393421	男. Character in Kino's Journey
393422	Porter Kikai	Q80447738	https://anilist.co/character/393422	ポーター機械. Character in Kino's Journey
393423	Waiter Kikai	Q80447738	https://anilist.co/character/393423	ウェイター機械. Character in Kino's Journey
393424	Koe	Q80447738	https://anilist.co/character/393424	声. Character in Kino's Journey
393426	Noa Halle	Q87576284	https://anilist.co/character/393426	ノア•ハレ. Character in Nina the Starry Bride