id	name	type	url	P4086	description
16460	Perrine Monogatari Specials	Q21441764			[withdrawn identifier value]
202427	Challenge 1-nensei de Kakkoii 1-nensei ni Henshin!	Q21441764			[withdrawn identifier value]
207439	Super Cub Rei	Q21441764			[withdrawn identifier value]
547	Wind: A Breath of Heart	Q113687694	https://anilist.co/anime/547	547	Wind -a breath of heart- OVA. 2004 anime. Directed by Tsuneo Tominaga
1409	IGPX Immortal Grand Prix (2003)	Q63952888	https://anilist.co/anime/1409	1409	IGPX Immortal Grand Prix (2003). 2003 anime. Directed by Kouichi Mashimo
1613	Jikuu Ihoujin KYOKO: Chocola ni Omakase!	Q220898	https://anilist.co/anime/1613	1613	時空異邦人KYOKO ちょこらにおまかせ！. 2001 anime. Directed by Takayuki Hamana
1619	Negima!? Magister Negi Magi: Spring	Q220898	https://anilist.co/anime/1619	1619	ネギま!?春 スペシャル!?. 2006 anime by Shaft. Directed by Akiyuki Shinbou
1732	Negima!? Magister Negi Magi: Summer	Q220898	https://anilist.co/anime/1732	1732	ネギま!?夏 スペシャル!?. 2006 anime by Shaft. Directed by Akiyuki Shinbou
1775	NAZCA	Q63952888	https://anilist.co/anime/1775	1775	時空転抄ナスカ. 1998 anime by Genco and Radix. Directed by Hiroko Tokita
1792	OVERMAN King Gainer	Q63952888	https://anilist.co/anime/1792	1792	OVERMANキングゲイナー. 2002 anime by Sunrise. Directed by Yoshiyuki Tomino
2279	The Wonderful World of Puss 'n Boots	Q20650540	https://anilist.co/anime/2279	2279	長靴をはいた猫. 1969 anime by Toei Animation. Directed by Kimio Yabuki
2862	A Time to Screw	Q113687694	https://anilist.co/anime/2862	2862	刻音色. 2004 anime. Directed by MOGLES
3239	Cream Lemon Series	Q113687694	https://anilist.co/anime/3239	3239	くりいむレモン. 1984 anime by AIC and APPP
3381	Nadia: Secret of Blue Water Specials	Q1107	https://anilist.co/anime/3381	3381	ふしぎの海のナディアおまけ劇場. 2003 anime
3980	Mija Beautiful Demon	Q113687694	https://anilist.co/anime/3980	3980	靡・淫導師 美傀 -淫辱の学園-. 2001 anime
4189	Winter Sonata	Q63952888	https://anilist.co/anime/4189	4189	冬のソナタ. 2009 anime by Studio Comet, REALTHING and KeyEast. Directed by Seok-Ho Yun
4406	Mazinger Z tai Ankoku Daishogun	Q20650540	https://anilist.co/anime/4406	4406	マジンガーＺ対暗黒大将軍. 1974 anime by Toei Animation
4723	Animated Classics of Japanese Literature	Q100269041	https://anilist.co/anime/4723	4723	青春アニメ全集. 1986 anime. Directed by Fumio Kurokawa
4849	Triangle Heart/Summer Sunset	Q113687694	https://anilist.co/anime/4849	4849	とらいあんぐるハート ～さざなみ女子寮～. 2000 anime
5419	Pani Poni Dash!: Danjite Okonaeba Kishin mo Kore wo Saku	Q220898	https://anilist.co/anime/5419	5419	ぱにぽにだっしゅ！ 断じて行えば鬼神もこれを避く. 2009 anime by Shaft. Directed by Akiyuki Shinbou
6276	The Curse of Kazuo Umezu	Q220898	https://anilist.co/anime/6276	6276	楳図かずおの呪い. 1990 anime by Takahashi Studio. Directed by Shigeyasu Yamauchi
6280	CAT SHIT ONE: THE ANIMATED SERIES	Q1047299	https://anilist.co/anime/6280	6280	CAT SHIT ONE -THE ANIMATED SERIES-. 2010 anime by Studio Anima. Directed by Kazuya Sasahara
6671	Space Three Musketeers	Q202866	https://anilist.co/anime/6671	6671	별나라 삼총사. 1979 anime. Directed by Jung-Kyu Lim
7591	My Lord and Me ~The Ambition Behind the Eyepatch~	Q220898	https://anilist.co/anime/7591	7591	殿といっしょ. 2010 anime by Gathering. Directed by Mankyuu
8275	Special Express 'Mithishio'	Q113687694	https://anilist.co/anime/8275	8275	姦淫特急 満潮. 2010 anime
10004	Agonashi Gen to Ore Monogatari	Q113671041	https://anilist.co/anime/10004		アゴなしゲンとオレ物語. 2010 anime
10089	Girls' Work	Q63952888	https://anilist.co/anime/10089		ガールズワーク. anime by ufotable
10424	Solo Sex	Q220898	https://anilist.co/anime/10424	10424	オナ×2. 2011 anime
13365	Samchongsa: Taimmeosin 001	Q202866	https://anilist.co/anime/13365	13365	삼총사 타임머신 001. 1980 anime. Directed by Jung-Kyu Lim
16363	VANQUISHED QUEENS	Q113687694	https://anilist.co/anime/16363	16363	ヴァンキッシュド・クイーンズ. 2013 anime by Hoods Entertainment. Directed by Shin Itagaki
18041	Rozen Maiden: Zurückspulen	Q63952888	https://anilist.co/anime/18041	18041	ローゼンメイデン (2013). 2013 anime by Studio DEEN. Directed by Shinichi Omata
18283	Sonyeon 007 Eunhateukgongdae	Q202866	https://anilist.co/anime/18283	18283	소년 007 은하특공대. 1980 anime. Directed by Jung-Kyu Lim
19773	Akuma Tou no Prince: Mitsume ga Tooru	Q1107	https://anilist.co/anime/19773	19773	悪魔島のプリンス 三つ目がとおる. 1985 anime by Toei Animation. Directed by Yuugo Serikawa
19995	King Kong - 00⅐ Tom Thumb	Q100269041	https://anilist.co/anime/19995	19995	キングコング・00⅐親指トム. 1967 anime. Directed by Hiroshi Ikeda
20577	HappinessCharge Precure!	Q63952888	https://anilist.co/anime/20577	21407	ハピネスチャージプリキュア！. 2014 anime by Toei Animation. Directed by Tatsuya Nagamine
20921	Cardfight!! Vanguard G	Q100269041	https://anilist.co/anime/20921	27815	カードファイト!! ヴァンガードG. 2014 anime by TMS Entertainment and Double Eagle. Directed by Yui Miura
21063	Kichiku ~Haha Shimai Choukyou Nikki~	Q113687694	https://anilist.co/anime/21063	21349	鬼畜 〜母姉妹調教日記〜. 2013 anime by ChiChinoya. Directed by Kazunori Mizuno
21164	Buta no Gotoki Sanzoku ni Torawarete Shojo wo Ubawareru Kyonyuu Himekishi & Onna Senshi: Zettai Chi●po Nanka ni Maketari Shinai!! THE ANIMATION	Q220898	https://anilist.co/anime/21164	28169	豚の如き山賊に捕らわれて処女を奪われる巨乳姫騎士&女戦士 ~絶対チ●ポなんかに負けたりしない!!~ THE ANIMATION. 2015 anime by Seven
21616	Gakuen no Ikenie: Nagusami Mono to Kashita Kyonyuu Furyou Shoujo ~Hakudaku ni Okasareru Kasshoku & Daniku no Kyouen~ THE ANIMATION	Q220898	https://anilist.co/anime/21616	30658	学園の生贄――慰み者と化した巨乳不良少女～白濁に侵される褐色＆堕肉の狂宴～ THE ANIMATION. 2015 anime by Office Takeout
21706	CoCO & NiCO	Q63952888	https://anilist.co/anime/21706	32944	ココとニコ. 2016 anime by Kachidoki Studio. Directed by Kyou Yatate
21739	Watashitachi, Luck Logic-bu! 2	Q113671041	https://anilist.co/anime/21739	33776	私たち, らくろじ部! 2. 2016 anime by Doga Kobo
102431	Dragon Ball Z: The Real 4-D	Q1107	https://anilist.co/anime/102431		ドラゴンボールZ・ザ・リアル 4-D. 2016 anime
102758	MISSION SCHOOL	Q64100970	https://anilist.co/anime/102758	21055	MISSION SCHOOL. 2006 anime by Ajiado. Directed by Tomomi Mochizuki
104278	Dropkick on My Devil! Episode 12	Q1047299	https://anilist.co/anime/104278	38383	邪神ちゃんドロップキック ONA. 2018 anime by Nomad
107138	WATATEN!: an Angel Flew Down to Me: You Never Let Us Down / Always Growing Closer / Let's Change You Into This! / I'm Your Big Sister	Q220898	https://anilist.co/anime/107138	38999	私に天使が舞い降りた！OVA. 2019 anime by Doga Kobo
113302	The Demon Girl Next Door Minis	Q113671041	https://anilist.co/anime/113302	40755	まちカドまぞく みに. 2019 anime by AQUA ARIS. Directed by Ryou Shiba
122758	Hi☆sCoool! SeHa Girl: Dai-54-Kai Hanpa Jano! Zenryoku de Guu! Youshou Suru no wa Only You! Subete no Gakkou Gyouji o Kako ni Suru! SeHaGaga Gakuen Taiikusai	Q220898	https://anilist.co/anime/122758	34323	Hi☆sCoool! セハガール: 第54回 ハンパじゃノー！全力でグー！優勝するのはオンリーユー！すべての学校行事を過去にする！セハガガ学園体育祭. 2016 anime by Sega Games. Directed by Souta Sugahara
128757	Tai-Ari deshita.: Ojou-sama wa Kakutou Game nante Shinai	Q63952888	https://anilist.co/anime/128757	46488	対ありでした。 ～お嬢さまは格闘ゲームなんてしない～. 2026 anime by diomedéa. Directed by Shouta Ibata
136140	Ryuusatsu no Kyoukotsu	Q1047299	https://anilist.co/anime/136140	48589	龍殺ノ狂骨. 2021 anime. Directed by Tsukasa Sakurai
137662	Release that Witch	Q1047299	https://anilist.co/anime/137662	62927	放开那个女巫. 2026 anime by Thundray
139751	The Summer	Q1047299	https://anilist.co/anime/139751	49982	그 여름. 2021 anime by Red Dog Culture House. Directed by Ji-Won Han
140291	Disney Twisted-Wonderland: The Animation	Q113671041	https://anilist.co/anime/140291	50139	ディズニー ツイステッドワンダーランド ザ アニメーション シーズン1「エピソード オブ ハーツラビュル」. 2025 anime by Yumeta Company and Graphinica. Directed by Shin Katagai
143103	Witch on the Holy Night	Q20650540	https://anilist.co/anime/143103	50668	魔法使いの夜. 2026 anime by ufotable
145759	Kochira Katsushikaku Kameari Kouenmae Hashutsujo Special: Uwasa no Kaipan Deka Toujou / Buchou yo! Are ga Paris no Hi da / Gekitotsu! Kami VS Ryoutsu	Q1107	https://anilist.co/anime/145759		こちら葛飾区亀有公園前派出所スペシャル 噂の海パン刑事登場／部長よ！あれがパリの灯だ／激突！神VS両津. 1997 anime
145781	Kochira Katsushikaku Kameari Kouenmae Hashutsujo Special: Seton Tankentai! Sumidagawa no Chikai - Omoide no Shiroi Kujira wo Sagase!	Q1107	https://anilist.co/anime/145781	33879	こちら葛飾区亀有公園前派出所スペシャル シートン探検隊！隅田川の誓い～思い出の白い鯨を探せ！. 2007 anime
145994	The Demon Girl Next Door Minis Season 2	Q113671041	https://anilist.co/anime/145994	51543	まちカドまぞく 2丁目 みに. 2022 anime by AQUA ARIS
155331	Dragon's Triumph in the Celestial Realm	Q1047299	https://anilist.co/anime/155331	63416	龙破九天. 2026 anime by Dancing CG Studio
156131	Banished from the Hero’s Party, I Decided to Live a Quiet Life in the Countryside Season 2	Q100269041	https://anilist.co/anime/156131	53488	真の仲間じゃないと勇者のパーティーを追い出されたので、辺境でスローライフすることにしました 2nd. 2024 anime by Studio Flad. Directed by Satoshi Takatou
160902	Ibrahim 3 Shuunen Kinen Animation	Q1047299	https://anilist.co/anime/160902	58034	イブラヒム3周年記念アニメ. 2023 anime. Directed by Natsuyasumi
166038	Observing Elena Evoy	Q1047299	https://anilist.co/anime/166038	54693	일레나 에보이 관찰 일지. 2023 anime by Laftel
166249	Me & Roboco: The Movie	Q20650540	https://anilist.co/anime/166249	55709	劇場版 僕とロボコ. 2025 anime by Studio Gallop. Directed by Akitarou Daichi
168343	HiFi Romance	Q64100970	https://anilist.co/anime/168343	56392	ハイファイ浪漫. 2023 anime by MANAA ANIMATION. Directed by banishment
168578	Son Gokuu ga Hajimaru yo: Koufuu Daiou no Maki	Q20650540	https://anilist.co/anime/168578	23815	孫悟空が始まるよー 黄風大王の巻. 1966 anime by Mushi Production
169080	Azur Lane: Bisoku Zenshin! Ni!!	Q100269041	https://anilist.co/anime/169080	56613	アズールレーン びそくぜんしんっ！にっ！！. 2026 anime by studio CANDY BOX. Directed by Shunji Maki
169228	FIST OF THE NORTH STAR: HOKUTO NO KEN	Q63952888	https://anilist.co/anime/169228	56646	北斗の拳 -FIST OF THE NORTH STAR-. 2026 anime by TMS Entertainment. Directed by Hiroshi Maeda
170822	Mukuwarenakatta Murabito A, Kizoku ni Hirowarete Dekiai sareru Ue ni, Jitsu wa Motteita Densetsu-kyuu no Kami Skill mo Kakusei shita	Q63952888	https://anilist.co/anime/170822	57005	報われなかった村人A、貴族に拾われて溺愛される上に、実は持っていた伝説級の神スキルも覚醒した. anime by l-a-unch・BOX. Directed by Masahiko Komino
176373	Shiranuhi	Q20650540	https://anilist.co/anime/176373		しらぬひ. 2026 anime by CoMix Wave. Directed by Ryou Katanosaka
178352	Gotchard Short Anime: Gotchanime - Furasu Koukou Nanafushigi wo Gotcha Seyo!	Q113671041	https://anilist.co/anime/178352	58753	ガッチャードショートアニメ ガッチャニメ 富良洲高校七不思議をガッチャせよ！. 2024 anime
178749	Mahou no Shimai Lulutto Lilly	Q100269041	https://anilist.co/anime/178749	59176	魔法の姉妹ルルットリリィ. 2026 anime by Studio Pierrot. Directed by Shintarou Douge
179813	Rooster Fighter	Q63952888	https://anilist.co/anime/179813	59393	ニワトリ・ファイター. 2026 anime by SANZIGEN. Directed by Daisuke Suzuki
180136	Tsuihou Sareta Tensei Juukishi wa Game Chishiki de Musou Suru	Q63952888	https://anilist.co/anime/180136	59741	追放された転生重騎士はゲーム知識で無双する. 2026 anime by GoHands. Directed by Katsumasa Yokomine
180228	Go For It, Nakamura-kun!!	Q1047299	https://anilist.co/anime/180228	59551	ガンバレ！中村くん！！. 2026 anime by Drive. Directed by Aoi Umeki
180743	Fate/Grand Order 6th Anniversary Trailer	Q1107	https://anilist.co/anime/180743		Fate/Grand Order 配信6周年記念アニメーションPV. 2021 anime by A-1 Pictures
180745	Classroom of the Elite 4th Season: Second Year, First Semester	Q100269041	https://anilist.co/anime/180745	59708	ようこそ実力至上主義の教室へ 4th Season 2年生編1学期. 2026 anime by Lerche. Directed by Noriyuki Nomata
180894	Romeria Senki: Maou wo Taoshita nochi mo Jinrui Yabasou dakara Guntai Soshiki Shita	Q63952888	https://anilist.co/anime/180894	59787	ロメリア戦記 〜魔王を倒した後も人類やばそうだから軍隊組織した〜. 2026 anime by Atra
182205	That Time I Got Reincarnated as a Slime Season 4	Q100269041	https://anilist.co/anime/182205	59970	転生したらスライムだった件 第4期. 2026 anime by 8-bit. Directed by Naokatsu Tsuda
182417	Re:Zero kara Hajimeru Kyuukei Jikan (Break Time) 3rd Season	Q113671041	https://anilist.co/anime/182417	60012	Re:ゼロから始める休憩時間(ブレイクタイム) 3rd Season. 2024 anime by Studio PuYUKAI. Directed by Minoru Ashina
183231	Rilakkuma: Goyururi Yume no Tabi	Q63952888	https://anilist.co/anime/183231		リラックマ ～ごゆるり夢の旅～. 2026 anime by Production I.G. Directed by Yoshimi Itazu
184072	Yuru Camp△ SEASON 4	Q100269041	https://anilist.co/anime/184072	60267	ゆるキャン△ SEASON４. 2027 anime by FuRyu Pictures. Directed by Shin Tosaka
184492	Welcome to Demon School! Iruma-kun Season 4	Q100269041	https://anilist.co/anime/184492	60310	魔入りました！入間くん 第4シリーズ. 2026 anime by Bandai Namco Pictures
185211	Yowayowa Sensei	Q63952888	https://anilist.co/anime/185211	60444	よわよわ先生. 2026 anime by Brain's Base
185725	Dushi Gu Xian Yi	Q1047299	https://anilist.co/anime/185725	59967	都市古仙医. 2024 anime
185901	TRUST	Q1047299	https://anilist.co/anime/185901	61040	TRUST. 2025 anime by POLYGON PICTURES. Directed by Chizuru Kakimoto
185903	DIVE IN!	Q1047299	https://anilist.co/anime/185903	61041	DIVE IN!. 2025 anime by Lesprit. Directed by Arisa Okada
185993	Noble Reincarnation: Born Blessed, So I'll Obtain Ultimate Power	Q113671041	https://anilist.co/anime/185993	60692	貴族転生 ～恵まれた生まれから最強の力を得る～. 2026 anime by CompTown. Directed by Michio Fukuda
186201	Secret Jouju (Season 1)	Q117467246	https://anilist.co/anime/186201	48334	치링치링 시크릿 쥬쥬. 2012 anime by Maro Studio. Directed by Il-Ho Park
186202	Secret Jouju - Bijou of Star	Q117467246	https://anilist.co/anime/186202		시크릿쥬쥬 별의 보석. 2023 anime by Pierce Visual Works. Directed by Il-Ho Park
186742	Toaru Anbu no ITEM	Q63952888	https://anilist.co/anime/186742	61014	とある暗部の少女共棲. 2026 anime by J.C.STAFF
186751	Hu Huan Shao Nu	Q1047299	https://anilist.co/anime/186751	63500	呼唤少女. 2026 anime by A4works
186822	Ki ni Natteru Hito ga Otoko ja Nakatta		https://anilist.co/anime/186822	61035	気になってる人が男じゃなかった. anime
187217	Gochuumon wa Usagi desu ka? Movie: ～We Are Family!～	Q20650540	https://anilist.co/anime/187217	61115	劇場版 ご注文はうさぎですか？ ～We Are Family!～. anime by Bibury Animation Studios. Directed by Motoki Tanaka
187225	LOS ANGELES LAKERS x ONE PIECE	Q1107	https://anilist.co/anime/187225		LOS ANGELES LAKERS x ONE PIECE. 2025 anime. Directed by Maya Asakura
187260	Kimi ga Shinu made Koi wo Shitai	Q63952888	https://anilist.co/anime/187260	61126	きみが死ぬまで恋をしたい. 2026 anime by ROLL2. Directed by Yasushi Tomoda
187267	BEASTARS Final Season Part 2	Q113671041	https://anilist.co/anime/187267	61114	BEASTARS FINAL SEASON Part 2. 2026 anime by Orange. Directed by Shinichi Matsumi
187316	Gensou Suikoden	Q63952888	https://anilist.co/anime/187316	61140	幻想水滸伝. 2026 anime by KONAMI animation. Directed by Yuuzou Satou
187990	Battle Spirits [Re] Zekkai No Ku	Q63952888	https://anilist.co/anime/187990		Battle Spirits [Re] 絶界の空. 2026 anime by Bandai Namco Pictures. Directed by Masashi Kudou
188546	Ore to Yuu-nii!	Q63952888	https://anilist.co/anime/188546	61282	俺と悠兄！. anime. Directed by Noriko Hashimoto
189046	Re:ZERO - Starting Life in Another World- Season 4	Q100269041	https://anilist.co/anime/189046	61316	Re:ゼロから始める異世界生活 4th season. 2026 anime by WHITE FOX
189121	BanG Dream! It's MyGO!!!!! / Ave Mujica (Zoku-hen)	Q100269041	https://anilist.co/anime/189121	61324	BanG Dream! It's MyGO!!!!! / Ave Mujica (続編). 2027 anime
191205	Easygoing Territory Defense by the Optimistic Lord	Q113671041	https://anilist.co/anime/191205	61549	お気楽領主の楽しい領地防衛. 2026 anime by NAZ. Directed by Tetsuya Tatamitani
191788	Aoashi 2nd Season	Q100269041	https://anilist.co/anime/191788	61603	アオアシ 第2期. 2026 anime by TMS Entertainment. Directed by Kazuki Yokoyama
192867	Does it Count if You Lose Your Innocence to an Android?	Q100269041	https://anilist.co/anime/192867	61694	アンドロイドは経験人数に入りますか？？. 2026 anime by Nyan Pollution-ω-. Directed by NekoB
193699	Akuyaku Reijou no Naka no Hito	Q63952888	https://anilist.co/anime/193699	61758	悪役令嬢の中の人. 2027 anime by ROLL2. Directed by Yoshihisa Iida
193923	Kono Hon wo Nusumu Mono wa	Q20650540	https://anilist.co/anime/193923	61770	この本を盗む者は. 2025 anime by Kagome Company. Directed by Daiki Fukuoka
195268	The Most Heretical Last Boss Queen: From Villainess to Savior Season 2	Q100269041	https://anilist.co/anime/195268	61931	悲劇の元凶となる最強外道ラスボス女王は民の為に尽くします。Season2. 2026 anime by OLM. Directed by Norio Nitta
195496	GATE 2: Jieitai Kano Umi nite, Kaku Tatakaeri	Q100269041	https://anilist.co/anime/195496	61973	GATE ２ ―自衛隊 彼の海にて、斯く戦えり―. 2027 anime by Studio M2. Directed by Tooru Takahashi
195703	"99-kai Danzai sareta Loop Reijou desu ga Konse wa ""Chouzetsu Aisare Mode"" desu tte!? Shin no Chikara ni Mezamete Hajimaru 100-kaime no Jinsei"		https://anilist.co/anime/195703	62002	99回断罪されたループ令嬢ですが今世は「超絶愛されモード」ですって!? 〜真の力に目覚めて始まる100回目の人生〜. anime
195833	Honoo no Toukyuujyo Dodge Danko	Q100269041	https://anilist.co/anime/195833	62031	炎の闘球女 ドッジ弾子. 2026 anime by CUE. Directed by Hiroshi Ikehata
196029	Kami no Niwatsuki Kusunoki-tei	Q63952888	https://anilist.co/anime/196029	62050	神の庭付き楠木邸. 2026 anime by JUVENAGE
196219	Mujikaku Seijo wa Kyou mo Muishiki ni Chikara wo Tare Nagasu	Q63952888	https://anilist.co/anime/196219	62080	無自覚聖女は今日も無意識に力を垂れ流す. 2026 anime by Magic Bus and Picante Circus. Directed by Mitsutaka Noshitani
197178	ONE PIECE HEROINES	Q1107	https://anilist.co/anime/197178	62233	ONE PIECE HEROINES. 2026 anime by Toei Animation. Directed by Haruka Kamatani
197824	Farming Life in Another World 2	Q100269041	https://anilist.co/anime/197824	62146	異世界のんびり農家２. 2026 anime by Zero-G. Directed by Ryouichi Kuraya
198411	Nezumi-kun no Chokki (TV)	Q63952888	https://anilist.co/anime/198411	62495	ねずみくんのチョッキ (TV). 2026 anime by Creadom8
198709	Tefuda ga Oume no Victoria	Q63952888	https://anilist.co/anime/198709	62476	手札が多めのビクトリア. 2026 anime by Studio DEEN
198726	Chainsaw Days	Q113671041	https://anilist.co/anime/198726		チェンソー びより. 2025 anime by MAPPA. Directed by Tatsuya Yoshihara
198767	Ichigo Aika: Strawberry Elegy	Q113671041	https://anilist.co/anime/198767	62897	イチゴ哀歌～雑で生イキな妹と割り切れない兄～. 2026 anime by Studio Houkiboshi. Directed by Hiyuuta Konno
198939	Jidou Hanbaiki ni Umarekawatta Ore wa Meikyuu wo Samayou 3rd Season		https://anilist.co/anime/198939	62512	自動販売機に生まれ変わった俺は迷宮を彷徨う 3rd Season. 2026 anime by AXsiZ and Studio Gokumi. Directed by Takashi Yamamoto
199029	Kanojo, Okarishimasu 5th Season	Q1047299	https://anilist.co/anime/199029	62485	彼女、お借りします 第5期. 2026 anime by TMS Entertainment. Directed by Kazuomi Koga
199221	Dr. STONE SCIENCE FUTURE Cour 3	Q100269041	https://anilist.co/anime/199221	62568	Dr.STONE SCIENCE FUTURE 3クール. 2026 anime by TMS Entertainment. Directed by Shuuhei Matsushita
199417	Wu Hun Dalu	Q1047299	https://anilist.co/anime/199417	62659	武魂大陆. 2025 anime by Ruo Hong Culture
199590	Matsurika Kanriden	Q63952888	https://anilist.co/anime/199590	62605	茉莉花官吏伝. 2027 anime by Maho Film
200769	Saikyou no Shokugyou wa Yuusha demo Kenja demo Naku Kanteishi (Kari) Rashii desu yo?	Q1047299	https://anilist.co/anime/200769	62825	最強の職業は勇者でも賢者でもなく鑑定士（仮）らしいですよ？. 2026 anime by Studio Flad. Directed by Makoto Hoshino
200929	Kusuriya no Hitorigoto Movie	Q20650540	https://anilist.co/anime/200929	62844	劇場版 薬屋のひとりごと. 2026 anime by TOHO animation STUDIO. Directed by Norihiro Naganuma
201514	Saijo no Osewa: Takane no Hanadarake na Meimonkou de, Gakuin Ichi no Ojou-sama (Seikatsu Nouryoku Kaimu) wo Kagenagara Osewa suru Koto ni Narimashita	Q63952888	https://anilist.co/anime/201514	62876	才女のお世話 高嶺の花だらけな名門校で、学院一のお嬢様(生活能力皆無)を陰ながらお世話することになりました. 2026 anime by Brain's Base. Directed by Shuusei Morishita
202251	Kanchigai no Atelier Meister: Eiyuu Party no Moto Zatsuyougakari ga, Jitsu wa Sentou Igai ga SSS Rank Datta to Iu Yoku Aru Hanashi 2nd Season		https://anilist.co/anime/202251	62924	勘違いの工房主～英雄パーティの元雑用係が、実は戦闘以外がSSSランクだったというよくある話～第2期. anime
202523	Marika's Love Meter Malfunction	Q63952888	https://anilist.co/anime/202523	62983	茉莉花ちゃんの好感度はぶっ壊れている. 2026 anime by studio LEO
203129	Akutou Ikka no Manamusume, Tensei-saki mo Otome Game no Gokudou Reijou deshita.: Saijoukyuu Ranku no Akuyaku-sama, Sono Dekiai wa Fuyou desu!		https://anilist.co/anime/203129		悪党一家の愛娘、転生先も乙女ゲームの極道令嬢でした。～最上級ランクの悪役さま、その溺愛は不要です！～. anime
204270	Evangelion 30th Anniversary Special Screening	Q1107	https://anilist.co/anime/204270	63392	エヴァンゲリオン放送30周年記念特別興行. 2026 anime by Studio Khara. Directed by Naoyuki Asano
204319	Do You Like Big Girls?	Q63952888	https://anilist.co/anime/204319	63248	大きい女の子は好きですか？. 2026 anime by Studio Houkiboshi. Directed by Souta Warai
204394	Fabulous Beasts 5	Q1047299	https://anilist.co/anime/204394	62955	有兽焉 第五季. 2026 anime by FENZ. Directed by Zhe Zhang
204541	MONSTER	Q64100970	https://anilist.co/anime/204541		MONSTER (Music). 2025 anime. Directed by Riri Yamashita
206166	Ingoku Danchi	Q63952888	https://anilist.co/anime/206166	63310	インゴクダンチ. 2026 anime by Elias
206523	Onegai AiPri	Q63952888	https://anilist.co/anime/206523		おねがいアイプリ. 2026 anime by OLM and Dongwoo Animation. Directed by Junichi Fujisaku
206914	NIPPON SANGOKU: The Three Nations of the Crimson Sun	Q1047299	https://anilist.co/anime/206914	63375	日本三國. 2026 anime by Studio Kafka. Directed by Kazuaki Terasawa
207329	"Tsuihou sareta Cheat Fuyo Majutsushi wa Kimama na Second Life wo Ouka suru.: Ore wa Buki dake ja Naku, Arayuru Mono ni ""Kyouka Point"" wo Fuyo Dekiru shi, Ore no Ishi de Itsudemo Kouka wo Kaijo Dekiru kedo, Nokotta Hitotachi Daijoubu?"	Q63952888	https://anilist.co/anime/207329	63431	追放されたチート付与魔術師は気ままなセカンドライフを謳歌する。 ～俺は武器だけじゃなく、あらゆるものに『強化ポイント』を付与できるし、俺の意思でいつでも効果を解除できるけど、残った人たち大丈夫？～. anime by P.A.WORKS
207594	Given: Hiiragi mix Specials	Q1107	https://anilist.co/anime/207594	61511	ギヴン 柊mix 特典映像. 2024 anime by Lerche
209132	Junket Bank	Q63952888	https://anilist.co/anime/209132	63713	ジャンケットバンク. 2026 anime by CUE. Directed by Seiji Kishi
209218	Bad End Mokuzen no Heroine ni Tensei shita Watashi, Konse de wa Renai suru Tsumori ga Cheat na Ani ga Hanashite Kuremasen!?		https://anilist.co/anime/209218		バッドエンド目前のヒロインに転生した私、今世では恋愛するつもりがチートな兄が離してくれません！？. anime
209219	Tensei Goblin Dakedo Shitsumon Aru?	Q63952888	https://anilist.co/anime/209219		転生ゴブリンだけど質問ある？. 2026 anime
209221	Isekai Tensei Soudouki	Q63952888	https://anilist.co/anime/209221	63730	異世界転生騒動記. anime
