id	name	type	url	P4087	description
188839	Uchi ni Asobi ni Konai?	Q21441764			[withdrawn identifier value]
200073	Happy End	Q21441764			[withdrawn identifier value]
30728	Astro Boy	Q21198342	https://anilist.co/manga/30728	728	鉄腕 アトム. 1952 manga by Osamu Tezuka
30971	The Art of Loving	Q21198342	https://anilist.co/manga/30971	971	恋愛幸福論. 1999 manga. Story & Art: Eiki Eiki, Story: Mikiyo Tsuda
32327	Ciao Ciao Bambino	Q21198342	https://anilist.co/manga/32327	2327	チャオチャオバンビーノ. manga by Momoko Tenzen
32696	Togainu no Chi Anthology Comic	Q21198342	https://anilist.co/manga/32696	2696	咎狗の血アンソロジーコミック. 2005 manga by Abi, Akane Sakurama, Akino Shiina, Hiroshi Asagi, HOPE, Fujiko Kosumi, Izo Suzuki, Kaho, Kazuhiko Mishima, Kazuki Tomomaya, Mamimu Saito, Michiru Mizusawa, Mio Motomura, Mizuki Fuuju, mute, Riya Hozumi, Saeko Kamon, Seika Umeda, Sumachii, Takumi Aoyagi, Tamanosuke Honda, Toshimi Nigoshi, Uryou, Yamaki and yuto
32914	Robot	Q21198342	https://anilist.co/manga/32914	2914	村田蓮爾責任編集 「robot」. 2004 manga by Mitsukazu Mihara, Yoshitoshi ABe, Makoto Kobayashi, Sayman Dowman, Shigeki Maeshima, Enomoto, Yumi Tada, Haccan, Ugetsu Hakua, Miggy, Yasuto Miura, SABE, YUG, Yasuyuki Nekoi, Shin Nagasawa, Range Murata, Hanaharu Naruko, Mami Itoh, Suzuhito Yasuda, Yuu Kinutani, Hiroyuki Asada, okama, Shouu Tajima, Kei Sanbe and Kengo Yonekura
32985	Adidas Manga Fever	Q21198342	https://anilist.co/manga/32985	2985	アディダスマンガフィーバー. 2002 manga. Story & Art: Hiroyuki Asada, Atsushi Kamijou, Nicolas de Crecy, Taiyou Matsumoto, Takehiko Inoue, Maki Kusumoto, Sakumi Yoshino, Yoshikazu Yasuhiko, Jirou Taniguchi, Iou Kuroda, Katsuya Terada, Takeshi Obata, Shouu Tajima, Yeong-Sun Yang and Kow Yokoyama, Illustration: Ai Yazawa, Hirohiko Araki, Yoshihiro Yamada, Reiko Okano, Ippei Gyoubu and Shinobu Nishimura
33334	Tsumi ni Nureta Futari	Q21198342	https://anilist.co/manga/33334	3334	罪に濡れたふたり. 1998 manga by Miyuki Kitagawa
33422	Patriot	Q21198342	https://anilist.co/manga/33422	3422	PATRIOT. 2004 manga by Mashumaro Juubaori
33424	Co-ed Sexxtasy	Q21198342	https://anilist.co/manga/33424	3424	凪ちゃんのゆううつ. 1996 manga by Fujisaki Makoto
33536	Heat: Ring of Destiny	Q21198342	https://anilist.co/manga/33536	3536	HEAT-運命の輪. 2005 manga by Fujisaki Makoto
33758	Yuri Hime Wildrose	Q21198342	https://anilist.co/manga/33758	3758	百合姫 Wildrose. 2007 manga. Story & Art: Haruka Minami, Chihiro Harumi, Saburouta, Rou Kawai, Kuzushiro, Momono Moto, Shuninta Amano, Rokuroichi, Linda Gyuunyuu, Nene Jounouchi, Iku Nanzaki, Kaori Monchi, Maco Hanada, Akiko Morishima, Otoha Izumiya, Hajime Mikuni, Miu Ootsuki, Hayase Hashiba, Kitsune Miyashita, Itsumi Takahashi, CHI-RAN, Touko Mizuno and Mitsue Aoki, Cover Illustration: Mikiyo Tsuda and Haruka Minami
34169	Sister Summer	Q21198342	https://anilist.co/manga/34169	4169	妹夏. 2007 manga by Teikoku Maguro
34591	Neo Devilman	Q21198342	https://anilist.co/manga/34591	4591	ネオデビルマン. 1999 manga by Kazuko Yumeno, Noriko Nagano, Shinobu Kaze, Akihiko Takadera, Miki Tori, Noboru Miyama, Ken Ishikawa, Katsuya Terada, Tatsuya Egawa, Yoshikazu Yasuhiko, Gou Nagai, Masaomi Kanzaki, Iou Kuroda, Shouu Tajima, Shinichi Hiromoto, Hitoshi Iwaaki and Reiji Hagiwara
34670	Dynamite na Honey	Q21198342	https://anilist.co/manga/34670	4670	ダイナマイトなハニー. 1998 manga by Nachika Ozaki
35038	.hack//Link	Q21198342	https://anilist.co/manga/35038	5038	.hack//Link. 2007 manga. Story: CyberConnect2, Art: Megane Kikuya
35390	CLANNAD: 4-koma Manga Gekijou	Q21198342	https://anilist.co/manga/35390	5390	CLANNAD 4コマ マンガ劇場. 2004 manga. Story & Art: Yuuya Sasagiri, Tsukasa Unohana, Kotomi Nekoma, Tomo, Nagi Shikage, Eiichirou Mashin, Haruka Komowata, Uzura Amano, Heisuke Strike, Senri Ebisu, Yuuya Aiba, Seiji Iwashi, Mio Hirose, Shinju Minami and Kasumi Tenkyuu, Cover Illustration: Haruka Komowata and Tsukasa Unohana (back), Illustration: Yuuya Sasagiri, Yukari Higa, Tsukasa Unohana, Kotomi Nekoma, Nagi Shikage, Haruka Komowata and Uzura Amano, Original Creator: Key
35391	Sunaebo	Q74262765	https://anilist.co/manga/35391	5391	순애보. 2006 manhwa by Se-Yeong Kim, Ju-Yeon Im, Gyo-Jeong Kwon, Eun-Ah Park, Ji-Un Yun, Moon Da Mi Seo, Yeong-Eun Kim, Si-Yeong Lee, Hyeon-Suk Lee, Yeon-Ju Kim, Ji-Sang Sin, Ye-Ri Na, Geo, Aivan, Yu-Ha Sin, Seon-Hui Kim, Si-Jin Yu, Hye-Jin Kang, Hye-Jin Sim and Ki-Hong Park
35671	Ano Ko ni 1000%	Q21198342	https://anilist.co/manga/35671	5671	あのこに1000％. 1989 manga by Miyuki Kitagawa
35672	Princess ARMY	Q21198342	https://anilist.co/manga/35672	5672	ぷりんせすARMY. 1990 manga by Miyuki Kitagawa
35704	Sweetie Gem	Q74262765	https://anilist.co/manga/35704	5704	스위티 젬. 1998 manhwa by Eun-Ah Park
35764	S.S. Astro	Q21198342	https://anilist.co/manga/35764	5764	教艦ASTRO. 2005 manga by Negi Banno
35773	Make Love Shiyo!!	Q21198342	https://anilist.co/manga/35773	5773	Ｍａｋｅ Ｌｏｖｅ しよ！！. 1996 manga by Mayu Shinjou
36274	Nude na Kajitsu-tachi	Q21198342	https://anilist.co/manga/36274	6274	ヌードな果実たち. 2005 manga by Miyuki Kitagawa
36286	Kimagure Grafitti	Q21198342	https://anilist.co/manga/36286	6286	気まぐれグラフィティ. 1989 manga by Miyuki Kitagawa
36288	Kimagure Engage	Q21198342	https://anilist.co/manga/36288	6288	気まぐれエンゲージ. 1992 manga by Miyuki Kitagawa
36290	Kimagure Wedding	Q21198342	https://anilist.co/manga/36290	6290	気まぐれウエディング. 1993 manga by Miyuki Kitagawa
36766	Kiss de GO!	Q21198342	https://anilist.co/manga/36766	6766	キッスでGO!. 2000 manga by Nachika Ozaki
36768	Kanjite GO!	Q21198342	https://anilist.co/manga/36768	6768	感じてＧＯ！. 2001 manga by Nachika Ozaki
36802	Goraihou Gakuen e Youkoso!	Q21198342	https://anilist.co/manga/36802	6802	御来訪学園へようこそ!. 2004 manga by Muku Kakizaki
37230	Suki Nante Ienai	Q21198342	https://anilist.co/manga/37230	7230	好きなんていえない. 2007 manga by Akira
37303	Cheerful Eros Project	Q21198342	https://anilist.co/manga/37303	7303	明るいエロス計画. 2007 manga by Yuzuki N'
37357	Dynamite Ai × Otoko	Q21198342	https://anilist.co/manga/37357	7357	ダイナマイト愛×男！. 2000 manga by Yuuki Kimoto
37580	Any Way I Want It...	Q21198342	https://anilist.co/manga/37580	7580	想うがままに…。. 2004 manga by Kei Matsuzawa
37742	Insomnia	Q74262765	https://anilist.co/manga/37742	7742	불면증. 2001 manhwa by Eun-Ah Park
37861	Holding on to Alex	Q21198342	https://anilist.co/manga/37861	7861	永遠の恋の魔法. 2002 manga. Story & Art: Misao Hoshiai, Original Story: Margaret Way
38011	Don't Call Me Your Teacher!	Q21198342	https://anilist.co/manga/38011	8011	先生って呼ばないで!. 2006 manga by Hazumi Yuuki
38105	Otona no Shoumei	Q21198342	https://anilist.co/manga/38105	8105	オトナの証明. 2008 manga by Mie Washio
38123	Kokoro de Nugasete	Q21198342	https://anilist.co/manga/38123	8123	心で脱がせて. 2001 manga by Yuuki Kimoto
38124	Motto Aishite Aisare Nakucchane!	Q21198342	https://anilist.co/manga/38124	8124	もっと愛して愛されなくっちゃね！. 2005 manga by Yuuki Kimoto
38125	Mune Sawagi RUSH RUSH RUSH!	Q21198342	https://anilist.co/manga/38125	8125	胸さわぎRUSH RUSH RUSH！. 2003 manga by Yuuki Kimoto
38126	Renai Shibai Shimasho	Q21198342	https://anilist.co/manga/38126	8126	恋愛芝居しましょ. 2006 manga by Yuuki Kimoto
38129	Umi wo Koete mo Koi wo Suru	Q21198342	https://anilist.co/manga/38129	8129	海をこえても恋をする. 2005 manga by Yuuki Kimoto
38289	Venus no Kamiyui	Q21198342	https://anilist.co/manga/38289	8289	ヴィーナスの髪結い. 2004 manga by Yuho Sorani
38412	Tonari de Nemuru Yoru: Hiina no Sensitive Love	Q21198342	https://anilist.co/manga/38412	8412	隣で眠る夜. 1997 manga by Hiina Maki
38654	Hanayaka na Adventure	Q21198342	https://anilist.co/manga/38654	8654	華やかなアバンチュール. 2003 manga. Story & Art: Hiromi Kobayashi, Original Story: Amanda Browning
39161	Himitsu no Shitsuji-kun	Q21198342	https://anilist.co/manga/39161	9161	ひみつの執事くん. 2007 manga by Mie Washio
39274	How to Get Your Guy to Open up	Q21198342	https://anilist.co/manga/39274	9274	恋人のヒラキカタ. 2007 manga by Aoi Kujou
39428	Fukigen na Aibu	Q21198342	https://anilist.co/manga/39428	9428	不機嫌な愛撫. 2001 manga by Miyuki Kitagawa
39803	Angelique: TREASURE	Q21198342	https://anilist.co/manga/39803	9803	アンジェリーク TREASURE. 2000 manga by Tsukasa Shimeno, Rei Omishi, Kaimu Tachibana, Akari Funato, Setsuko Yoneyama, Reku Fuyunagi, Tamayo Akiyama, Kairi Yura, Muunii Mucchiri, Ayumi Kasai, Kiya Ootomo, Katsumi Nakagawa, Suzunari Shimokitazawa, Tatsuya Kinami and Ryou Kitagami
40152	Kamisama ni Misutereta 20 Hiai: Kankin Jiken no Yukue	Q21198342	https://anilist.co/manga/40152	10152	神様に見捨てられた20日間―監禁事件の行方. 2005 manga by Reiko Momochi
40603	Phoenix Wright: Ace Attorney Official Casebook: Vol. 1: The Phoenix Wright Files	Q21198342	https://anilist.co/manga/40603	10603	逆転裁判オフィシャルアンソロジーコミック 成歩堂編. 2006 manga. Story & Art: Kikuchiyo Anko (vols 1,2), Wataru Yamasaki (vols 1,2), Yuuya Kurokami (vols 1,2), Eiji Kaneda (vol 1), Tsubaki Mikage (vol 1), Kaname Uchimura (vol 1), Kazuo Maekawa (vol 2), Atsuo Ueda (vol 1), Tamako Yamauchi (vol 1), Kei Nisemura (vol 1), Sevens Gear (vol 1), Aira Kanou (vol 2), Natsu Otono (vol 2), Shinosuke (vol 2), Maao Aou (vol 2), DAIGO (vol 2), Rinta Hashiba (vol 2), Tomo (vol 2), Hajime Nagata (vol 2), Tsukapon (vol 2) and Rin Hashiba (vol 2), Art: Karuna Kanzaki (vol 1)
40604	Phoenix Wright: Ace Attorney Official Casebook: Vol. 2: The Miles Edgeworth Files	Q21198342	https://anilist.co/manga/40604	10604	逆転裁判 オフィシャルアンソロジーコミック 御剣編. 2006 manga. Story & Art: Yuukou Yai (vols 1, 2), Shihoko Sugiyama (vols 1, 2), Mami Tachibana (vols 1,2), Yunomi Hisamatsu (vol 1), Wataru Akizuki (vol 1), Akira Houjou (vol 1), Lucy Tanaka (vol 1), Rinta Hashiba (vol 2), Hiro Touge (vol 2), Harue Motegi (vol 2), Reala Kasori (vol 2), Zonbi Chiryuu (vol 2), Yuuka Kannoju (vol 2), Saki Ichijou (vol 2), Yashi Fujimaru (vol 2), Kazuo Maekawa (vol 2), Kikuchiyo Anko (vol 1) and Kiyono Shimanda (vol 2), Art: Suzume Nogaki (vol 1) and Karuna Kanzaki (vol 2)
40845	HIGH & HIGH	Q21198342	https://anilist.co/manga/40845	10845	HIGH & HIGH. 2008 manga by Muku Kakizaki
41391	Atsu Atsu Trattoria	Q21198342	https://anilist.co/manga/41391	11391	あつ・あつトラットリア. 2006 manga by Mie Washio
41499	Bounen no Zamned: Junreisha no Rashinban	Q21198342	https://anilist.co/manga/41499	11499	亡念のザムド 巡礼者の羅針盤. 2008 manga by Masahiro Kawanabe
41842	Edith	Q21198342	https://anilist.co/manga/41842	11842	エディス. 2008 manga by Komine Kevin (vol 4A, 5A), Puku Okuyama (vols 3, 4B-5A), Fuuka Mizutani (vol 3-4A), Manami Kisaragi (vols 2-3, 4B), Mano Sakamoto (vols 1, 5A), Miggy (vol 1), Gido Amagakure (vols 2-3, 4B), Eitatsu (vols 3, 4B, 5B), Omaru (vols 3, 4B, 5B), Wakaba (vol 5B), Notari Muratomo (vol 4B, 5B), EHIME (vol 5B), Nobara (vol 4A, 5B), Haruki Fujimoto (vol 1-5A), Yayoi Haruna (vol 1-5A), Niwasuke Tsunekawa (vol 1-2), Shou Kazeki (vols 1-3), Ikumi Katagiri (vol 2), Yone Sesshou (vols 1-4A), Hachi Izumo (vols 1-3), Aoi (vol 1), Hayato Kaji (vol 2), Miki Rinno (vol 3), Pepu (vols 3, 4B) and Sume (vols 4B-5A)
41968	Code Geass: Queen	Q21198342	https://anilist.co/manga/41968	11968	コードギアス 反逆のルルーシュ 公式コミックアンソロジー For Boys -Queen-. 2007 manga by Naoto Ayano, Naoko Kodama, Kou Kawarajima, Hirofumi Naruse, Chinjaorosu, Emua, Chiruwo Kazahana, Asuka Kanan, Yukio Kumoya, Yuki Azuma, Yuuki Tanaka, Rena Izumibara, Miki Kizuki, Hakone Odawara, Tomomasa Takuma, Kiro Hanehane, Akuru Uira, Aya Sakurai, Hina Shirogane, Mimori Mizusawa and Tsukako Akina
42042	Code Geass: Hangyaku no Lelouch Koushiki Comic Anthology: Knight - for Girls	Q21198342	https://anilist.co/manga/42042	12042	コ－ドギアス反逆のルル－シュ公式コミックアンソロジ－Ｋｎｉｇｈｔ-- for Girls. 2007 manga by Nokiya, Sawaki Otonaka, Nao Katoo, Fujiko Kosumi, Kagura Hinomoto, Sumeragi, Watari, Chinjaorosu, Aki Miyamoto, Mayu Shinjou, Yuki Kiriga, Ren Hidou, Eri Sakondou, Shinichi Fuji, Atsuro Yomino, Aya Shouoto and Ran Mutsuki
42529	Tales of Symphonia: BC Anthology Collection	Q21198342	https://anilist.co/manga/42529	12529	テイルズオブシンフォニア BC アンソロジーコレクション. 2005 manga. Story & Art: Petit Morishima, Yui Hara, Manami Sugano, Megumu Aya, K, Shiki Tanaka, Harao and Kaoru Osada, Cover Illustration: Hitoshi Ichimura, Illustration: Kairi Sorano and Harao, Original Creator: Bandai-Namco Entertainment
42658	Petit Yuri-Hime	Q21198342	https://anilist.co/manga/42658	12658	Petit 百合姫. 2008 manga. Story & Art: Mera Hakamada, Kaoru Sudoo, Maya Mizuki, Hajime Mikuni, Iku Nanzaki, Sunao Minakata, Nene Jounouchi, Shoko Iwami, Pochi Edoya, Akihito Yoshitomi, Mizuo Shinonome, CHI-RAN, Hayase Hashiba, Otoha Izumiya, Akiko Morishima, Nobuyuki Takagi, Kowo Kazuma and Takewakamaru, Story: Tomoyuki Fumotogawa, Art: Pochi Edoya
42927	Guin Saga: The Seven Magi	Q21198342	https://anilist.co/manga/42927	12927	グイン・サーガ 七人の魔道師. 2000 manga. Story: Kaoru Kurimoto, Art: Kazuaki Yanagisawa
42984	Sexual Serenade	Q21198342	https://anilist.co/manga/42984	12984	情交セレナーデ. 2006 manga by Kei Matsuzawa
43160	Majo wa Nido Aegu	Q21198342	https://anilist.co/manga/43160	13160	魔女は二度喘ぐ. 2009 manga by Miyuki Kitagawa
43227	Engulfed by a Sea of Hot Sand	Q21198342	https://anilist.co/manga/43227	13227	熱砂の海に抱かれて. 2005 manga by Kou Natsuo
43450	Kuroshitsuji Anthology Comic Nijishitsuji	Q21198342	https://anilist.co/manga/43450	13450	黒執事アンソロジーコミック虹執事. 2009 manga. Story & Art: Mimori, Kiichi Hotta, toi8, Ryu Miyanaga, Hajime Kirino, Jirou Suzuki, Mika Takeda, Akiyo Satorigi, Tsuna Kitaumi, Mochi, Satsuki Yoshino, Kanako Takagi, Chiaki Nagaoka, Wakana Hazuki, Naoko Nakamura, Shima Tajima, Nobara Sakurai and Kao, Cover Illustration: Yana Toboso, Illustration: Shinobu Ootaka, KEI, Cocoa Fujiwara, Takeshi Okazaki, Kairi Shimotsuki and pako
43531	Slave Contract	Q21198342	https://anilist.co/manga/43531	13531	隷属契約書. 1994 manga by Gorou Horikawa
43572	Sexy・Cool Voice	Q21198342	https://anilist.co/manga/43572	13572	セクシークールボイス. 2005 manga by Kou Fujisaki
43892	Sayuri Hime	Q21198342	https://anilist.co/manga/43892	13892	小百合姫. 2008 manga by Mako Takahashi, CHI-RAN, Mera Hakamada, Miyabi Fujieda, Akiko Morishima, Hiyori Otsu, Kowo Kazuma, Sunao Minakata, Nene Jounouchi, Marika Tanimura, Maya Mizuki, Yayoi Oosawa, Misao Kurokiri, Yaya Hanatsu, Minoru Tanaka and Seiro Yuzuha
44500	Platonic	Q21198342	https://anilist.co/manga/44500	14500	プラトニック - 八木＆寺山. 1991 manga by Senko Toumiya
45116	Shugo Chara Chan!	Q21198342	https://anilist.co/manga/45116	15116	"しゅごキャラちゃん!. 2008 manga. Original Creator: PEACH‐PIT, Story & Art: Mizushima Napthalian, Kinomin (vols 1, 2), Sakyou (vols 1, 3), Ema Tooyama (vol 1, 3), Miyuki Etoo (vols 1-3), Yuriko Abe (vols 1-3), Natsumi Andou (vol 2) and Michiyo Kikuta (vol 2), Original Story: Miyoko Ikeda (vol 2: ""Youkai Navi Luna"")"
46630	Nemurenai Yoru wo Kazoete	Q21198342	https://anilist.co/manga/46630	16630	眠れない夜をかぞえて. 1998 manga by Miyuki Kitagawa
46901	Dreamseller	Q21202185	https://anilist.co/manga/46901	16901	ゆめうり. 2004 one-shot manga by Wadarco
46910	Kemono for ESSENTIAL	Q21198342	https://anilist.co/manga/46910	16910	獣 for ESSENTIAL. 2004 manga by Masato Tsukimori, Tsubasa Komine, Mitsuka Hattori, Rokurou Isako, Tahichi Yamada, Henmaru Machino, Tsubasa Komine, Michiyoshi Kuon, Chikiko, Hitode Jinbo, Asuka Shiraishi, Femio Tenma, Reona Takeuchi, Ryuushirou Shimon, Okome Takeichi, Thunder Sugi, Yuuichi Hosaka, Tetsuya Moriguchi, DELTA-M and Tsuzuki Ichinose
46999	Black Jack alive	Q21198342	https://anilist.co/manga/46999	16999	ブラック・ジャックalive. 2005 manga. Story & Art: Kenichi Kitami, Makoto Satou, Makoto Tezuka, Yoshihiko Inui, Shouta Kikuchi, Juichi Iogi, Atsuko Takakura, Mio Murao, Kyo Haduki, Ayumi Tachihara, Masayuki Taguchi, Masahiro Shibata, Naoki Serizawa, Ken Yagami, Yoshihisa Tagami, Naito Yamada, Gou Nagai, Yasuko Aoike, Satosumi Takaguchi, Akihito Yoshitomi and Yoshifumi Kondou, Original Creator: Osamu Tezuka
47018	Hatsukoi Lunch Box	Q21198342	https://anilist.co/manga/47018	17018	初恋ランチボックス. 2009 manga by Nao Kodaka
47384	Sky	Q21198342	https://anilist.co/manga/47384	17384	SKY. 1996 manga by Noboru Rokuda
47508	Kimi to Ao Bara Ryou de	Q21198342	https://anilist.co/manga/47508	17508	キミと蒼薔薇寮で. 2008 manga by Mie Washio
47512	Togabito to Melody	Q21198342	https://anilist.co/manga/47512	17512	咎人とメロディ. 2012 manga by Satoshi Morie
47620	Kichiku Megane Kounin Comic Anthology	Q21198342	https://anilist.co/manga/47620	17620	鬼畜眼鏡公認コミックアンソロジー. 2009 manga. Story & Art: Juugorou Isaka, Saeko Kamon, Milk Jinnai, Poco, Una Megurogawa, Torino Rakuda, Takanori Yagi, Nonochiki, Nora, Woko Shiina, Emiko Takiyama and China Asaka, Cover Illustration: Lemon Ichijou, Illustration: Fuuri Misasagi, Original Story: Spray, Character Design: Fuuri Misasagi
47635	.hack//Epitaph of Twilight	Q104213567	https://anilist.co/manga/47635	17635	.hack//黄昏の碑文. 2008 light novel by Miu Kawasaki
48431	Kao no nai Tsuki Comic Collection	Q21198342	https://anilist.co/manga/48431	18431	顔のない月 Comic Collection. 2002 manga. Story & Art: Kagami Yoshimizu, Hyuura Konata, Carnelian, Mami Urano, Aya Sakurai, Munekichi, Puzzle Itsuka, Takahisa Kiru, Youji Kotomi, Hanamaru Togawa, YUUHO and Naoki Nosaka, Cover Illustration: Carnelian, Illustration: Carnelian
48980	To Sow A Seed	Q21198342	https://anilist.co/manga/48980	18980	種を蒔く人. 2009 manga by Terashima
49017	Lucky☆Star: Comic a la Carte - Happy Strike!	Q21198342	https://anilist.co/manga/49017	19017	らき ☆ すたコミックアラカルト ～はっぴーストライク！～. 2007 manga. Original Creator: Kagami Yoshimizu, Cover Illustration: Eeji Komatsu, Illustration: Ayumi Takato, Kankiriko and Masahito Watari, Story & Art: Akari Ryuryuu, Datto Nishiwaki, Eretto, GUNP, Hotori, Motoki Takeuchi, Munmun Hatomugi, Ranchi Okosama, Shuu, Takashi Atsu, Takatsu, Tekkentou and Tomoya Haruno
49485	Shounen Shikou	Q21198342	https://anilist.co/manga/49485	19485	少年嗜好. 2003 manga. Story & Art: Hokuto Mikami (vols 1-5), Kagechin (vol 6), Hiroyuki Sugou (vols 3-5), Shigetaka Morota (vols 2-6), Hirohisa Onikubo (vol 6), Hilo Hoshiai, Akira Caskabe (vols 4-6), Po-ju (vols 1, 2), Juan Gotou (vol 5), Rei Shinozaki (vol 1), UCHO-TEN (vols 1-5), Mahiro Takura (vol 6), Macop., Minion (vol 6), Takahiro Kawai (vol 6), Furawa Yoshida (vol 4), Riko Ooide (vols 1, 2), Inumaru (vols 1, 2, 4, 5) and RT. (vols 3, 5), Cover Illustration: Akira Caskabe, Illustration: Po-ju (vol 1), Munyu (vol 3), UCHO-TEN (vol 6), Gatame Sasori (vols 2, 3, 6) and Inumaru (vol 6)
49544	The Name Of Love	Q21198342	https://anilist.co/manga/49544	19544	その気持ちに名前をつける. 2008 manga by Naoko Momoyama
49551	K-On! Anthology Comic	Q21198342	https://anilist.co/manga/49551	19551	けいおん! アンソロジーコミック. 2009 manga by Kazuho, Tarou Kinniku, Nagumo., Aki Konishi, Shinta Sakayama, Hiro, Ryousangata Serebi, Iri Arata, Yuusuke Shiba, Shinobu Take, Gengorou, Koi, Tachi, Shima Matsuda, Hota., Ikki Sanada, Kana Yoshimura, Gao Yuzuki, Satori Kounosu, Shirou Usume, Kito, Shion Shirayuki, Shin Hashimoto, Haru Yatosaki and Warito Nishiuri
49630	Hush A Bye Baby	Q21198342	https://anilist.co/manga/49630	19630	Hush-a-by-Baby. 1988 manga by Yuriko Matsukawa
49929	A Taste of Love!	Q21198342	https://anilist.co/manga/49929	19929	愛をめしあがれ;愛をめーあがれ. 2010 manga by Sumomo Momojiri
49930	Soft Thorns	Q21198342	https://anilist.co/manga/49930	19930	やわらかな棘. 2010 manga
49935	Ikenai Seito Kaichou	Q21198342	https://anilist.co/manga/49935	19935	イケない生徒会長. 2010 manga by Yuuri Naruse
49951	Love Secret	Q21198342	https://anilist.co/manga/49951	19951	恋愛・SECRET. 2010 manga by Yuri Tajima
49998	Welcome to the Hunk Cafe	Q21198342	https://anilist.co/manga/49998	19998	イケメンカフェにようこそ. 2010 manga by Chisa Mori
50057	Togainu no Chi Anthology: Shiki Maniax	Q21198342	https://anilist.co/manga/50057	20057	咎狗の血アンソロジー シキ・マニアックス. 2010 manga. Story & Art: Akino Shiina, Itsumi Takasugi, Kazuki Tomomaya, Mio Motomura, Mizuki Fuuju, Nozomu, Poroko Chin, Rairu Mizukami and Takumi Aoyagi, Cover Illustration: AKKE, Character Design: Chinatsu Kurahana, Original Creator: Nitro+CHiRAL
50383	Jin to Neko wa Yobu to Konai	Q21198342	https://anilist.co/manga/50383	20383	ジンと猫は呼ぶと来ない. 2010 manga by SHOOWA
50387	Zecchou Boshi	Q21198342	https://anilist.co/manga/50387	20387	絶頂母子. 2008 manga. Story & Art: Mitsuka Hattori, Shigezu Edo, Nagisa Shiraishi, Oshare Kyoushitsu., Harurun, Lynch Yokoyama, Sakae Saito, Mikikazu, Ryujin Aruza, Kishi Koujin, Forester, Kotarou Uoman, Keiichi Kishida and Usagi Nagisano, Original Story: Nami Umiko
50845	Meisaku 4-koma Hakurankai	Q21198342	https://anilist.co/manga/50845	20845	名作4コマ博覧会. 2010 manga by Natsuki Takaya, Maki Minami, Kaede Kouchi, Naomi Yamauchi, Mineo Maya, Hisamu Oto, Nanpei Yamada, Izumi Tsubaki, Mai Nishikata, Kiyo Fujiwara, Shigeru Takao, Kou Matsuzuki, Hisaya Nakajo, Yoko Matsushita, Saki Hiwatari, Yoshiki Nakamura, Banri Hidaka, Mizuho Kusanagi, Tachibana Higuchi, Ryou Saenagi, Ryouko Fukuyama, Emura and Maiko Yamaguchi
51158	Comic Gunbuster	Q21198342	https://anilist.co/manga/51158	21158	コミックガンバスター. 1989 manga. Story & Art: Haruhiko Mikimoto, Hiroyuki Utatane, Yoshitoo Asari, Kenichi Sonoda, Izumi Matsumoto, Takehiko Itou, Toshimitsu Shimizu, Hideaki Anno, Itoyoko, Yasuhiro Moriki, Kimiko Higuchi and Kei Ikeda, Original Character Design: Haruhiko Mikimoto and Yoshiyuki Sadamoto
51699	Persona 4 Comic Anthology: Hinotama Game Comic Series	Q21198342	https://anilist.co/manga/51699	21699	ペルソナ4コミックアンソロジー 火の玉ゲームコミックシリーズ. 2008 manga by Guriko Magami, Makoto Itsuki, Michiru Katou, emily, Kazutomo Ichitomo, Reku Hayase, Reo Horiguchi, Shou Akizuki, Emi Igarashi, Hinako Aoi, Yuuko Kawata, Hayato Aoba, Verno Mikawa, Akira Shikibu, Kotoni Shiroishi, Uka Nagao, Hiromi Taihei, Kazuomi Mochizuki, Fubito Mikanagi, Tama Mizugaki, Pochi Nikaidou, May Sakazaki, Atsushi Tatsumi, KAY and Mame
51774	Lonely Madame	Q21198342	https://anilist.co/manga/51774	21774	拝啓！ロンリーマダム. 2009 manga by Kaoru Hazuki
51850	Love Connection	Q21198342	https://anilist.co/manga/51850	21850	恋愛関係. 2008 manga by Kou Natsuo
53108	Keeping Luke's Secret	Q21198342	https://anilist.co/manga/53108	23108	せつない秘密. 2008 manga. Story & Art: Hinoto Mori, Original Story: Carole Mortimer
53289	If I Take Your Hand	Q21198342	https://anilist.co/manga/53289	23289	その手を取れば. 2010 manga by Ryouko Chiba
53290	Zero Sum Original Anthologies: Arcana	Q21198342	https://anilist.co/manga/53290	23290	ゼロサムオリジナルアンソロジーシリーズ Arcana. 2006 manga by Yun Kouga (vols 1-4), Kazuya Minekura (vols 1-3, 5, 9), Shinobu Takayama (vols 1-4, 8, 11, 16), Yaku Haibara (vols 1, 2, 8), Yashirou Saeki (vols 1, 3-15), Yoshinori Kisaragi (vols 1, 3, 4, 6), Touya Mikanagi (vols 1, 5, 8), Yui Kikuta (vols 1, 5), Setsuko Yoneyama (vols 1, 6, 8, 11), Fukusuke Miyamoto (vols 1, 8), Guriko Magami (vols 2-7, 9-12), Arashi Shindou (vols 2, 4-6, 9, 13, 15), Yasuka Asada (vols 2, 5, 8, 10, 12, 14), Haruka Mazaki (vols 2, 5, 8), Reo Kouzuki (vols 2, 5, 7, 10, 14), Kenta Mizuhara (vols 2, 7, 10, 13, 15), Yuu Fujiwara (vols 2, 13), Sakura Kinoshita (vols 3, 4, 9-11), Shinshuu Ueda (vols 3, 5, 7, 10), Verno Mikawa (vols 3, 6, 7, 9, 11-13, 15, 16), Yuzu Mizutani (vols 3, 7), D. Kissan (vols 3, 7, 9, 13-16), Mayu Kosugi (vols 3, 8, 13), Erika Kari (vols 3, 11-15) and Shiki Kayase (vols 4-7, 10, 12, 14, 16)
53439	Jack the Wicked	Q21198342	https://anilist.co/manga/53439	23439	邪悪のＪａｃｋ. manga
54500	One Summer in Italy	Q21198342	https://anilist.co/manga/54500	24500	孤独な富豪. 2008 manga. Story & Art: Nanami Akino, Original Story: Lucy Gordon
54665	Red	Q21198342	https://anilist.co/manga/54665	24665	レッド. 1999 manga. Story & Art: Hiromi Kobayashi, Original Story: Erica Spindler
54795	The Amalfi Bride	Q21198342	https://anilist.co/manga/54795	24795	アマルフィの花嫁. 2009 manga. Story & Art: Maia Tori, Original Story: Ann Major
54838	The Tiger's Table	Q74262765	https://anilist.co/manga/54838	24838	호랑님의 식탁. 2010 manhwa by Hae-Yeon Im
54933	Marriage Scandal	Q21198342	https://anilist.co/manga/54933	24933	情熱の果てに. 2008 manga. Story & Art: Maia Tori, Original Story: Sharon Kendrick
55268	The Wedding In White	Q21198342	https://anilist.co/manga/55268	25268	純白のウエディング. 2008 manga. Story & Art: Maia Tori, Original Story: Diana Palmer
55517	The Moon and the Sun	Q21198342	https://anilist.co/manga/55517	25517	月と太陽. 2009 manga by Nerimono Sakamata
55858	LoveChild	Q21198342	https://anilist.co/manga/55858	25858	不実な恋人. 2009 manga. Story & Art: Sami Fujimoto, Original Story: Metsy Hingle
