id	name	type	url	P4087	description
153190	Gekkan Web Otoko no Ko-llection! S	Q21198342	https://anilist.co/manga/153190		月刊Web男の娘・れくしょんっ！S. 2016 manga. Story & Art: Yuu Takase (vols 1, 2, 4, 7, 9, 11, 14, 17, 21, 30, 36), Kaeru Hanamaki (vols 1-10, 12-21, 23-25, 27-34, 40-43, 46, 52, 55, 56, 58), Takemaru Takasaki (vol 84), Wazuka Inochi (vols 12, 14, 17), Satoru Saba (vols 5, 11, 26), Paruko Nagashima (vols 1-10, 12-20, 22-33, 35-44, 47, 49-51, 53, 55, 57, 59-62, 65, 66, 68, 70, 71, 73, 74, 76-78, 81-84, 87, 89, 91, 94, 95), Marui Shiro (vols 39, 43, 45, 48, 50, 55, 58, 61, 72, 74, 77, 79, 82, 86, 93), Yuuji Kirimoto (vols 1, 3, 7, 13, 33, 40, 44, 52), fk696 (vol 4), Toranosuke Hayashida (vols 3, 5, 8, 10, 11, 14, 15, 19, 21, 22, 25, 27, 29, 32, 34, 36, 37, 44, 48, 52, 56, 61, 64, 66, 70, 73, 80, 89, 94), Zun Shinogiri (vols 30, 35, 46), Ichi Nagi (vol 9), Binto (vols 19, 24, 26, 29, 31, 33, 36), Nokoppa (vols 2, 8, 12, 16, 20, 24, 28, 32, 35, 37, 39, 44, 49, 51, 55, 59, 63, 68, 73, 82, 88, 94), Menoko (vol 3), Kaeru Ouchi (vols 42, 45-55, 57-69), Emuda (vols 15, 22), Bunpei Sumiyama (vols 1, 3, 7, 9, 11, 13, 15, 18), Omecho (vols 2, 12, 14), RAND Coin (vol 6) and Kazuho Akatsuki (vols 11, 23, 60, 96), Cover Illustration: Makuro (vols 1-6), Dancyo (vols 7-27, 29-48, 51, 52, 55), Yuuji Kirimoto (vol 28) and Kaeru Ouchi (vols 49, 50, 53, 54, 56-97)
153300	Bakunyuu Gal to Mechakucha Pakoru Goudou!!!	Q21198342	https://anilist.co/manga/153300		爆乳ギャルとメチャクチャパコる合同!!!. 2019 manga. Original Creator: Kirome, Cover Illustration: Kirome, Story & Art: Kirome, Kuro no Miki, Kloah, Sian, KANZUME, EO Masaka, Tabigarasu, Blue_Gk, uni8, Hakaishin, Shiki NAZE, Dekosuke, Mocchinu Asakai, Banana Ao, Diisuke and Sou Mikagami, Illustration: Calpish, Pachi Nori and KEN
153368	Pawahara Seijo no Osananajimi to Zetsuen Shitara, Nanimokamo ga Umaku Iku You ni Natte Saikyou no Boukensha ni Natta: Tsuide ni Yasashikute Kawaii Yome mo Takusan Dekita	Q104213567	https://anilist.co/manga/153368		パワハラ聖女の幼馴染みと絶縁したら、何もかもが上手くいくようになって最強の冒険者になった ～ついでに優しくて可愛い嫁もたくさん出来た～. 2021 light novel. Illustration: Mappaninatta, Story: Kusamochi
153374	My Childhood Friend Stole My Class	Q21198342	https://anilist.co/manga/153374		女戦士に転生したボクおさななじみ勇者のゆきちゃんにいじられああ射精が止まらない. 2022 manga by Hideyu Tougarashi
153538	"""Raise de Kekkonshitekuremasu ka"" to Chikatta Buka ga, Gensei de wa Toshiue no Kishi Danchou-sama ni Natteite, Hontouni Kekkon wo Semarareteiru Ken"	Q21198342	https://anilist.co/manga/153538		「来世で結婚してくれますか」と誓った部下が、現世では年上の騎士団長様になっていて、本当に結婚を迫られている件. 2022 manga. Story & Art: Koma Toyama, Original Story: Shirohi
153642	Theory of Human Evolution	Q754669	https://anilist.co/manga/153642		人类进化论. 2017 manhua by Gengfu Zhu
153784	Osananajimi ga Zettai ni Makenai Love Come: Comic Anthology	Q21198342	https://anilist.co/manga/153784	158088	幼なじみが絶対に負けないラブコメ コミックアンソロジー. 2021 manga. Original Story: Shuuichi Nimaru, Cover Illustration: Ui Shigure, Character Design: Ui Shigure, Story & Art: Tatsuya Endou, Teto Tachitsu, Mitsuki Kaga, Moyashi Ime, Hiroaki Itou, Kasumi Morino, Ren Sakuragi and Kairaku Kano
153891	Isekai de Cheat Skill wo Te ni Shita Ore wa, Genjitsu Sekai wo mo Musou Suru: Girls Side - Kareinaru Otome-tachi no Bouken wa Sekai wo Kaeta	Q104213567	https://anilist.co/manga/153891		異世界でチート能力を手にした俺は、現実世界をも無双する ガールズサイド ～華麗なる乙女たちの冒険は世界を変えた～. 2022 light novel. Story: Ryou Kotohira, Illustration: Rein Kuwashima, Original Story: Miku
154179	Kyonyuu na JS4 no Manamusume wo Seiteki na Me de Miru Dame Papa desu ga, Zenbu Baretetashi Goui no Ue de Oyako Kozukuri Sei Ecchi mo Sasete Kureta node Paradise desu!!!	Q21198342	https://anilist.co/manga/154179		巨乳なJS4の愛娘を性的な目で見るダメパパですが、全部バレてたし合意の上で父娘子作り生えっちもさせてくれたのでパラダイスです！！！. 2022 manga by Yasumi Holiday
154218	I'm Giving the Disgraced Noble Lady I Rescued a Crash Course in Naughtiness: I'll Spoil Her with Delicacies and Style to Make Her the Happiest Woman in the World!	Q104213567	https://anilist.co/manga/154218	151180	婚約破棄された令嬢を拾った俺が、イケナイことを教え込む 〜美味しいものを食べさせておしゃれをさせて、世界一幸せな少女にプロデュース!〜. 2020 light novel. Story: Sametarou Fukada, Illustration: Sakura Miwabe
154266	One Piece 1000-wa Kinen! Tokubetsu Bangai-hen	Q21198342	https://anilist.co/manga/154266	150042	ONE PIECE 1000話記念! 特別番外編. 2021 manga. Story & Art: Kentarou Yabuki, Mitsutoshi Shimabukuro, Ryuuhei Tamura, Kouhei Horikoshi, Yuuki Tabata, Atsushi Nakamura, Ryou Nakama, Hitsuji Gondaira, Gege Akutami, Tomohiro Hasegawa, Shuuhei Miyazaki, Yoshifumi Tozuka, Kazu Kakazu, Yuuto Suzuki, Hajime Koumoto, Kei Kamiki and Yuujirou Koyama, Story: Riichirou Inagaki and Tougo Gotou, Art: Boichi and Kento Matsuura
154694	"Munou wa Fuyou to Iware ""Tokei Tsukai"" no Boku wa Shokuin Guild kara Oidasareru mo, Dungeon no Shinbu de Shin no Chikara ni Kakusei Suru"	Q104213567	https://anilist.co/manga/154694		無能は不要と言われ『時計使い』の僕は職人ギルドから追い出されるも、ダンジョンの深部で真の力に覚醒する. 2022 light novel. Story: Kohaku Sakurakiri, Illustration: Kitsune Fuku
154829	Mangaka! Sekai Bungaku: Tanbi to Heroine	Q21198342	https://anilist.co/manga/154829		マンガ化! 世界文学 耽美とヒロイン. 2022 manga. Story & Art: Suzue Miuchi, Moto Hagio, Shio Satou, Ryouko Yamagishi, Hideko Mizuno, Kyouko Fumizuki, Miyako Maki and Yasuko Sakata, Original Story: Murasaki Shikibu, Charles Perrault, Jacob and Wilhelm Grimm, Hans Christian Andersen, Jeanne-Marie Leprince de Beaumont, Louis Hémon and Ichiyou Higuchi, Cover Illustration: Hideko Mizuno
154901	Romance Gray Fellows	Q21198342	https://anilist.co/manga/154901		ロマンスグレー フェローズ. 2022 manga. Story & Art: Kazune Yamamoto, Asaya Miyanaga, Yaya Takaesu, Seira Fukuta, Natsuko Takahashi, Yuko Fukunami, Sakura Hamada, Mari Ikebukuro, Mai Kawamoto, Saki Shiraishi, Kurumi Sanehara, Mizuki Sakumoto, Hirohito Kino, Kiyomi Uchida, Tasuku, Satoko Yoshikawa, Suzuka Morino, Yukosa Karo and Sano Hikarida, Cover Illustration: Seira Fukuta
155273	2D Dream Color Comic Collection	Q21198342	https://anilist.co/manga/155273		二次元ドリームカラーコミックコレクション. 2011 manga. Story & Art: Souryu, Yoshihisa Inoue, Potion, LEYMEI, Wataru Ootsuki, Mahiro Ootori, Kotatsu Furuwa, Tachibana, FCT, Kuu Kouki, Aranobu Takeda, Nimu, Parfait, CYCLONE, Kukui Kyan, MAKI, Love Hamon, Keiya Kaibara, e4, u, Sakura Hayashi and Koishi Yoshikoma, Cover Illustration: Tachibana and CYCLONE
155568	To Be Cute	Q21198342	https://anilist.co/manga/155568		きゅ～てぃ～ぱい. 2010 manga by KOJIROU!
155714	Lucky☆Star: Comic a la Carte - Lucky Turn ♪	Q21198342	https://anilist.co/manga/155714		らき ☆ すたコミックアラカルト ～ラッキーたーん♪～. 2008 manga. Original Creator: Kagami Yoshimizu, Cover Illustration: Naru Nanao, Illustration: Eeji Komatsu, Akio Watanabe and Akane Ikegami, Story & Art: Yuki Kiriga, Yuki Azuma, Ui Takano, Shou Ryuuga, Shin Kyogoku, GUNP, Hotori, Shuu, Ayumi Takato, Kankiriko, Mana Kagurazaka and Haruno Nanjou
155715	Lucky☆Star: Comic a la Carte - Lucky Spiral	Q21198342	https://anilist.co/manga/155715		らき ☆ すたコミックアラカルト ～ラッキーすぱいらる～. 2008 manga. Original Creator: Kagami Yoshimizu, Cover Illustration: Hiro Suzuhira, Illustration: Kenjirou Hata, Yukio Hirai and Chikotam, Story & Art: Yunomi Hisamatsu, Jingrock, Ui Takano, Kurumi Morisaki, Motoki Takeuchi, Hinata Yaya, Ryokuji Yoshizawa, Tekkentou, SAA, RikaON, Nakasa Sakanaya, Puzzle Itsuka, Natsumi Kasano, Daisuke Itou, MIKOTO, Memeko Satou and Halcyon
155717	Lucky☆Star: Comic a la Carte - Brilliant☆Star	Q21198342	https://anilist.co/manga/155717		らき ☆ すたコミックアラカルト ～ブリリアント☆すたー～. 2009 manga. Original Creator: Kagami Yoshimizu, Cover Illustration: Torishimo, Illustration: KEI, Akane Ikegami and Shino, Story & Art: Akari Ryuryuu, Nagian, Manabu Aoi, Bukubu Ookawa, GUNP, Chougenbou Musashiya, Ayumi Takato, Kashi, Suzu Kouno, Yumi Shiina, Eunos, Kimiko Higuchi, Kankiriko, Nakasa Sakanaya and Ore to Umi
155864	I'm the Only Slacker in My Sect!	Q754669	https://anilist.co/manga/155864		门派只有我一个渣渣. 2020 manhua. Story & Art: You Yu Hu Yu, Original Story: Shui Mu Qing Hua
155976	Lycoris Recoil Official Comic Anthology: Reload	Q21198342	https://anilist.co/manga/155976	154401	リコリス・リコイル 公式コミックアンソロジー リロード. 2022 manga. Story & Art: Muru Imigi (vols 1, 2), Akitaka, Tachi, Satoru Abo, Tadadi Tamori, Peke, Fuuka Sunohara, Mokeo, Momose Hanada, Sai Naekawa, Umi Yamamura, Penguin Yokoshima, Horoda, Sotaro Takemoto and Ikra, Character Design: Muru Imigi, Cover Illustration: Muru Imigi (vols 1, 2)
156119	Nise Seijo da to Ikenie ni Saretara, Maou-sama ni Kyuukon Saremashita: Keiyaku Hanayome wa Seirei-tachi to Slow Life wo Ooka Suru	Q21198342	https://anilist.co/manga/156119		偽聖女だと生贄にされたら、魔王様に求婚されました～契約花嫁は精霊たちとスローライフを謳歌する～. 2022 manga. Story & Art: Jio Fukayama, Original Story: Lemon Yuzu
156129	The Twelve Nights of Christmas	Q21198342	https://anilist.co/manga/156129		罠にかかったシンデレラ. 2013 manga. Story & Art: Nami Akimoto, Original Story: Sarah Morgan
156151	Scroll if You Dare	Q74262765	https://anilist.co/manga/156151	157688	2022 스크롤금지. 2022 manhwa. Story & Art: Sam-Chon, Dan Woo, Rangddo, Horang, Jun-Ho Hwang, Huinari, Digeut, Aeon, Ryoung, Yong-Ki Kim, Daeyang Lee, 247, Spring, Yuk Gong, Tae-Ho Go, Su-Min Lee, Mangsoon, Hudeusae and Lee-Yeon Kim, Story: Oenunbagi, Irae Seo and Kingsnal, Art: Jui-Joo, Yeong-I Yeong and Do-Yeon Kim
156152	Isekai Craftsman: A Relaxing Tale of Chilling and Building from scratch	Q21198342	https://anilist.co/manga/156152	147956	異世界クラフトぐらし～自由気ままな生産職のほのぼのスローライフ～. 2021 manga. Story & Art: Rin Tateyama, Original Story: Aroe, Character Design: Neru Izumo
156166	"Point Gifter ""Keikenchi Bunpai Nouryoku-sha"" no Isekai Saikyou Slow Life: Black Guild kara Kaihou Sareta Otoko wa Bannou Saikyou Shoku to Shite Musou Suru"	Q104213567	https://anilist.co/manga/156166		ポイントギフター《経験値分配能力者》の異世界最強ソロライフ～ブラックギルドから解放された男は万能最強職として無双する～. 2022 light novel. Story: Skyfarm and Nishiki Tsukumo, Illustration: Souichi Itou
156167	"Point Gifter ""Keikenchi Bunpai Nouryoku-sha"" no Isekai Saikyou Slow Life: Black Guild kara Kaihou Sareta Otoko wa Bannou Saikyou Shoku to Shite Musou Suru"	Q21198342	https://anilist.co/manga/156167	155825	ポイントギフター《経験値分配能力者》の異世界最強ソロライフ～ブラックギルドから解放された男は万能最強職として無双する～. 2022 manga. Story & Art: Akira Hino, Original Story: Skyfarm and Nishiki Tsukumo, Character Design: Souichi Itou
156192	Bocchi the Rock! Comic Anthology	Q21198342	https://anilist.co/manga/156192	155641	ぼっち・ざ・ろっく！アンソロジーコミック. 2022 manga. Original Creator: Aki Hamaji, Cover Illustration: Sadoru Chiba (vol 1) and Rasuko Ookuma (vol 2), Illustration: Hikari Matsuda (vol 1), Uso Uzaki (vol 1), Instant (vol 1), Hoshi (vol 1), Souma (vol 1), HOJI (vol 1), Iwawa (vol 1) and Mebachi (vol 2), Story & Art: Yuichi (vol 1), Takeo Kyuujuu (vol 1), Shirou Urayama (vol 1), Kashmir (vol 1), Takahide Totsuno (vol 1), Fujino Fuji (vol 2), Sunao Kasuga (vol 2), Yuunon Nagayama (vol 2), Yuka Ishii (vol 2), Tatsunokosso (vol 2), Maiko Uchino (vol 1), Hiroki Toda (vol 2), Rihito Urushino (vol 2) and Kitsune Fuku (vol 1)
156225	Ganbare Nougyou Seijo: Seijo no Chii to Konyakusha wo Ubawareta Reijou no Nougyou Kakumei Nisshi @COMIC	Q21198342	https://anilist.co/manga/156225		がんばれ農強聖女～聖女の地位と婚約者を奪われた令嬢の農業革命日誌～@COMIC. 2022 manga. Story & Art: Nasuo Age, Original Story: Kyouseki Sasaki, Character Design: Hatori Kyoka
156248	Sex ga Mannerika Shite Kita node 3P Aite wo Boshuu shitara Kawaii Kao shita Kyokon Danshi ga Arawarete Danjo Douji ni Okasareru Manga	Q21198342	https://anilist.co/manga/156248		セッ○スがマンネリ化してきたので3P相手を募集したら可愛い顔した巨根男子が現れて男女同時に犯される漫画. 2021 manga by Tooru Nagase
156327	Moe no Shinri	Q21198342	https://anilist.co/manga/156327		萌えの真理. 2010 manga by Shinri Fuwa, Kano Miyamoto, Shiuko Kano, Nase Yamato, Gureko Nankin, Sanae Rokuya, Kai Nanase, Deathco Cotorino, Masako Shimada, Shibito Koiwazurai, Marumi Koike, Ringo Manda, Kaisa Shitoh, Delico Psyche, SHOOWA, Arata Suzui, Rikako Tsuji, Kasai Matsuki, Naoko Otake, Nanako Tomoe, Nohara Chiba, Nagisa Shinohara and Tomomi Haneda
156347	Mushikaburi-hime: Koushiki Comic Anthology - Kimi wa Boku no Takaramono	Q21198342	https://anilist.co/manga/156347		虫かぶり姫 公式コミックアンソロジー～君は僕の宝物～. 2020 manga. Original Story: Yui, Character Design: Satsuki Shiina, Cover Illustration: Yui Kikuta, Story & Art: Yui Kikuta, Isuzu Shibata, Tomoko Mitani, Tetete Tanaka, Hizuki, Mami Surada, Sen Nakihara, Yumika Kanade and Suzumushi
156414	SSS Romance Collection	Q74262765	https://anilist.co/manga/156414	162156	SSS급 로맨스 단편선. 2022 manhwa. Story: Somnip, Da-Da Lee, Horeuja, Wolhet, Da-Da Lee and Heung and Hong, Art: Nubi, Se-Woon Jeong, Nubi, Yu-Sin Kim, Shalom, Ye-Seul Kang and Ha-Rim Jung, Coloring: Jae-Hyeon Lee, Chaekkong, Ju-Hui Lee, Jae-Hyeon Lee, 554 and Ju-Hui Lee, Background Art: Ju-Hui Lee and 554, Story & Art: Saejagga
156878	Self-indulgent Vanilla	Q21198342	https://anilist.co/manga/156878	160609	ひとりよがりのバニラ. 2021 manga by Joe Fuyufusa
156924	Osananajimi Kanojo no Morahara ga Hidoi n de Zetsuen Sengen Shite Yatta: Jibun Rashiku Ikiru Koto ni Shitara, Naze ka Tonari no Seki no Kakure Bishoujo kara Kokuhaku Sareta	Q21198342	https://anilist.co/manga/156924	153408	幼馴染彼女のモラハラがひどいんで絶縁宣言してやった ~自分らしく生きることにしたら、なぜか隣の席の隠れ美少女から告白された~. 2022 manga. Story & Art: Hige, Original Story: Manimani Ononata, Character Design: U35
156926	Osananajimi Kanojo no Morahara ga Hidoi n de Zetsuen Sengen Shite Yatta: Jibun Rashiku Ikiru Koto ni Shitara, Naze ka Tonari no Seki no Kakure Bishoujo kara Kokuhaku Sareta	Q104213567	https://anilist.co/manga/156926		幼馴染彼女のモラハラがひどいんで絶縁宣言してやった ~自分らしく生きることにしたら、なぜか隣の席の隠れ美少女から告白された~. 2022 light novel. Story: Manimani Ononata, Illustration: U35
157283	Jakushou Ryouchi no Seizon Senryaku! Ore no Ryouchi ga Nando Sourihenshite mo Metsubou Suru n dakedo. Kore, Doushitara Tasukarimasu ka?	Q21198342	https://anilist.co/manga/157283	170461	弱小領地の生存戦略！～俺の領地が何度繰り返しても滅亡するんだけど。これ、どうしたら助かりますか？～. 2022 manga. Original Story: Yamashita Sei Ebisu Fuyu Shougun, Story & Art: Akira Kazumiya, Character Design: Tomozero
157284	Jakushou Ryouchi no Seizon Senryaku! Ore no Ryouchi ga Nando Sourihenshite mo Metsubou Suru n dakedo. Kore, Doushitara Tasukarimasu ka?	Q104213567	https://anilist.co/manga/157284		弱小領地の生存戦略！～俺の領地が何度繰り返しても滅亡するんだけど。これ、どうしたら助かりますか？～. 2022 light novel. Story: Yamashita Sei Ebisu Fuyu Shougun, Illustration: Tomozero
157377	She's Nothing but a Stone	Q21202185	https://anilist.co/manga/157377		さっちゃんは石になった. 2022 one-shot manga by Elck Itsumo
157604	Higurashi no Naku Koro ni Anthology Novel	Q104213567	https://anilist.co/manga/157604		ひぐらしのなく頃にアンソロジーノベル. 2005 light novel. Illustration: Rei Izumi (Vol 1, vol 3, vol 7), Takehito Mizuki (Vol 2, vol 4, vol 6), Yuki Azuma (Vol 1, vol 3, vol 5), Kaname Uchimura (Vol 1, vol 3, vol 5, vol 7), Kiki Suihei (Vol 5), Ayami Chiha (Vol 7), Maruchan. (Vol 2, vol 4, vol 6), Mari Amou (Vol 2, vol 4, vol 6), Ayame Nanami (Vol 1, vol 3), Nanami Kahara (Vol 1, vol 3, vol 5, vol 7), Umi Takatori (Vol 2, vol 4, vol 6), Keiji Mori (Vol 2, vol 4, vol 6) and Kirishima Riona (Vol 5, vol 7), Original Creator: Ryukishi07, Cover Illustration: Yuki Azuma (Vol 3), Kyourin Takanae (Vol 2, vol 4, vol 6) and Akane Ikegami (Vol 1, vol 5, vol 7), Story: Hiroya Moriyasu (Vol 1), Majika (Vol 1, vol 3), Rizuki Touya (Vol 1), Masamune Yotsuya (Vol 1), Keiichirou Yagami (Vol 1) and Kiryu Haruto (Vol 2 - 3)
157671	Lycoris Recoil Official Comic Anthology: Repeat	Q21198342	https://anilist.co/manga/157671	155639	リコリス・リコイル 公式コミックアンソロジー リピート. 2022 manga. Story & Art: Takeshi Kojima (vol 1), Mekimeki (vol 1), Nyoijizai (vol 1), GUNP (vol 1), Itsuki Takano (vol 1), Ren Sakuragi (vol 1), sometime (vol 1), Ryou Niina (vol 1), Ginmoku (vol 1), Mikaduchi (vol 1), Nikomi Wakadori (vol 1), Miki Morinaga (vol 1), Raika Suzumi (vol 1), Ree (vol 1), Itsuki Tsutsui (vol 2), Utashima (vol 2), Shirou Urayama (vol 2), Bonryuu (vol 2), Yasuka Manuma (vol 2), Yuichi (vol 2), Marco Nii (vol 2), Nana Komado (vol 2), Yuu Kimura (vol 2) and sugar. (vol 2), Cover Illustration: Atto (vol 1)
157691	Beware of the Beast		https://anilist.co/manga/157691		この男、猛獣につき要注意。―危険な後輩の極上セックス―. 2018 work. Story: Chizu Aoi, Art: Mia Yuzuki
157951	100th Day After Disappearance	Q754669	https://anilist.co/manga/157951		妹妹消失的第一百天. 2016 manhua. Story & Art: Mao Zhua r, Original Story: Wo have Yanzhong Wangxiangzheng
158215	Higurashi no Naku Koro ni Kira: Ayakashisenshi-hen (Tsutomu)	Q21198342	https://anilist.co/manga/158215		ひぐらしのなく頃に煌 妖戦し編-努-. 2011 manga. Original Creator: Ryukishi07, Story & Art: Ayame Nagi, Nagi Gouda, Ranma Kusumi, Horiyayu, Kazuma Yamazaki, Mio Hibiki, Taichi Amasora, Asami Yukawa, Nikubanare, Nyan Miso, Todoroki, Takato, Gepan, Miyu Misato and Taka, Cover Illustration: Ayami Chiha, Original Story: Suu Maekawa
158223	Higurashi no Naku Koro ni Wonderful	Q21198342	https://anilist.co/manga/158223	137367	ひぐらしのなく頃に わんだふる. 2011 manga. Original Creator: Ryukishi07, Story & Art: Kaname Uchimura, Ayame Nagi, Nagi Gouda, Horiyayu, Daisuke Arakubo, Mio Hibiki, Tonnosuke, Asami Yukawa, Azuma Shoko, Yamato, Nyan Miso, Todoroki, Gepan, ico and Yuuma Mayuma, Cover Illustration: Hanokage
158335	Higurashi no Naku Koro ni: Kitan Senshuu	Q21198342	https://anilist.co/manga/158335		ひぐらしのなく頃に 奇譚撰集. 2009 manga. Story & Art: Eri Takenashi (Vol 1 - 2), Kabocha (Vol 1, vol 3), Juri Misaki (Vol 1, vol 4), Tasuke Sakura (Vol 1, vol 4), Ayami Chiha (Vol 1), Kosaka Taira (Vol 1 - 3), Yutaka Matsuzaki (Vol 1 - 4), Hako Itagaki (Vol 1), Rumi Kawashima (Vol 1) and Kazuya Tani (Vol 2 - 4), Original Creator: Ryukishi07, Cover Illustration: Ayami Chiha (Vol 1, vol 3) and Kazusa Yoneda (Vol 2, vol 4), Illustration: Kazusa Yoneda (Vol 1)
158681	Rider Suit Heroine: Anthology Comics	Q21198342	https://anilist.co/manga/158681		ライダースーツヒロイン アンソロジーコミックス. 2006 manga. Story & Art: Koma Amezawa, Jiru Drill, Tomoe Ichijou, Jun Jinnai, Akagi (vol 1), Tokisana (vol 2), Masae Tendou (vol 2), Yoshikage Nakami (vol 2), Kazuma Kinjou (vol 1), Donan (vol 1), MAKI (vol 2) and Jihodaka Kuon (vol 2), Cover Illustration: Takayuki Asaki (vol 1) and Shino (vol 2), Illustration: Shougun Denki (vol 1), Masae Tendou (vol 1), R1 (vol 1), Hiroaki Enomoto (vol 1), maruku (vol 1), Woda 9 (vol 2) and kodamashi (vol 2)
158820	Higanbana no Saku Yoru ni	Q21198342	https://anilist.co/manga/158820		彼岸花の咲く夜に. 2011 manga. Story & Art: Ayame Nagi, Nagi Gouda, Horiyayu, Kazuma Yamazaki, Daisuke Arakubo, Kazuomi Minatogawa, Yuukou Yai, Todoroki, Geban, Sakana no Hone, Karaton, Mio Hibiki, Asami Yukawa and Taka, Cover Illustration: Nishieda, Original Creator: Ryukishi07
158922	Muv-Luv Comic Anthology	Q21198342	https://anilist.co/manga/158922		マブラヴコミックアンソロジー. 2003 manga. Story & Art: BENNY'S, Cherry Arai, Hitoshi Mizuki, Uzura Amano, Takahiro Akizuki, Heisuke Strike, Nanami Kahara, Masashi Hazama, Soukichi Shinya, Ryuuken Sakura, Sayuki, Shirou Nishiki, Pa and Malcolm.X, Cover Illustration: Nanami Kahara and Masashi Hazama, Illustration: BENNY'S, Cherry Arai, Akaza, Toshihira Arata, Soukichi Shinya and Gou Nagase, Original Creator: Age and Kouki Yoshimune
158924	Muv-Luv: Game Comic	Q21198342	https://anilist.co/manga/158924		マブラヴ : ゲームコミック. 2003 manga. Story & Art: Masaya Takamura, Yukino, Eiichirou Mashin, Takahiro Akizuki, Kiyono Shimanda, Torirudan, Kagome-β, Sajin Tsukuyomi, Tatsuo Hida, Takashi Masayaka, Kiichi Ayano and Toshino Yatsuhiko, Cover Illustration: Daisuke Arakubo, Illustration: Takemaru Yokoshima, Chiruwo Kazahana, Soukichi Shinya and Saigetsu Anzu, Original Creator: Age and Kouki Yoshimune
158941	MagiQ 4-Koma: Muv-Luv Alternative Total Eclipse	Q21198342	https://anilist.co/manga/158941		マジキュー4コマ マブラヴ オルタネイティヴ トータル・イクリプス. 2012 manga. Story & Art: Rei Kusakabe, Tomo Hirokawa, Ranchi Okosama, Ryouta Momoi, Yui Musumi, Yuuko Nobukawa, Shin Mori, Chi, Aru Mizushima, Sorattama, Megumi Kimura, Pappaka Shino, Suzuha Morina, Ichigo Niwano and Maro Mashiro, Cover Illustration: Piz Gunjou
158953	Muv-Luv Anthology Comic	Q21198342	https://anilist.co/manga/158953		マブラヴアンソロジーコミック. 2003 manga. Story & Art: Rokuro Shinofusa, Ayato Sasakura, Hekaton, Sagiri Suda, Kinusa Shimotsuki, Haruka Ogataya, Benjamin, Daisuke Arakubo, Munekichi, Pa, NAL, Yuusuke Matsuda, Pon Ibuki and Fuushi Oniya, Illustration: Mine Yoshizaki, Inuburo, G3 Ida, Kyousuke Hinata and Mii-kun, Original Creator: Age and Kouki Yoshimune
159038	Miyazawa Kenji Mangakan	Q21198342	https://anilist.co/manga/159038		宮沢賢治・漫画館. 1985 manga. Story & Art: Osamu Tezuka, Leiji Matsumoto, Hisashi Sakaguchi, Shigeru Mizuki, Seiichi Hayashi, Shigeru Tamura, Hideko Mizuno, Minori Kimura, Oji Suzuki, Yousuke Takahashi, Shinji Nagashima, Murasaki Yamada, Moribi Murano, Yuukichi Yamamatsu, Koji Suzuki, Kazuyoshi Iino and Hiroshi Asuna, Original Creator: Kenji Miyazawa
159084	"Kono Boukensha, Jinrui-shi Saikyou desu: Hazure Sukiru ""Kantei"" ga ""Keishou"" ni Kakusei Shita node, Amata no Eiyuutachi no Chikara wo Uketsugi Musou Suru"	Q21198342	https://anilist.co/manga/159084	181805	この冒険者、人類史最強です ～外れスキル『鑑定』が『継承』に覚醒したので、数多の英雄たちの力を受け継ぎ無双する～. 2022 manga. Original Story: Sora Hinokage, Story & Art: Riku Miyake, Character Design: Essual
159123	Umineko no Naku Koro ni	Q21198342	https://anilist.co/manga/159123		うみねこのなく頃に. 2007 manga. Original Creator: Ryukishi07, Story & Art: Kaname Uchimura, Ayame Nagi, Nagi Gouda, Hanokage, Ranma Kusumi, Lita Tachibana, Kurumi Suzushiro, Shinobu Minazuki, Horiyayu, Kuroe Mura, Tomomi Mizuna, Muraji, Dobato, Asami Yukawa, Kifumi Kayama, Nikubanare, Azuma Shoko, Yamato, Michiru Kataoka, ico, Nyan Miso, shuz, Hanamaru Togawa and Koeko
159130	Muv-Luv Anthology Comics	Q21198342	https://anilist.co/manga/159130		マブラヴ アンソロジーコミックス. 2003 manga. Story & Art: Kinusa Shimotsuki, Shounen Sasaki, Takemaru Yokoshima, Ayame Nagi, RIKI, Ranma Kusumi, Daisuke Arakubo, Hiura R, Asami Yukawa, Ao Fujii, Torirudan, Takato Enjouyu, Kotarou Aizawa, Sanae Takahashi, Asahi, Kotoko Narushima and Hitomi Umemoto, Original Creator: Age and Kouki Yoshimune, Illustration: Nankotsu Misakura and Mangetsu○
159133	ToHeart	Q21198342	https://anilist.co/manga/159133		トゥハート. 2001 manga by Izumi Kawachi, Kinusa Shimotsuki, Shounen Sasaki, Nemigi Toto, Rusty Soul, Ranma Kusumi, Ranchi Okosama, Seneka Aruto, Daisuke Arakubo, Monta Tokita, Yuu Katase, Munekichi, Hiura R, Zuna Yoshino, Uzura Amano, Morihito Kanehira, Wataru Yamasaki, Ao Fujii, Yuuma Mayuma, Torirudan, Mikazu Satsuki, Sanae Takahashi, Shidou Yato no Yami, Shimo-san and Nayumi Renshou
159140	Ki no Tsuyoi Onna Joushi (31-sai Hitozuma) wo Shigotochuu ni Yobidashite, Gouin ni Nakadashi SEX Shitara Chotto dake Dereta Ken www	Q21198342	https://anilist.co/manga/159140		気の強い女上司（31歳・人妻）を仕事中に呼び出して、強引に中出しSEXしたらちょっとだけデレた件www. 2016 manga by Hyakuhachi Yoroduya
159278	Kamikakushi Inc.: Agents of the Supernatural	Q21198342	https://anilist.co/manga/159278		株式会社神かくし. 2022 manga by Yousuke Katayama
