id	name	type	url	description
381679	Uchuujin-tachi	Q80447738	https://anilist.co/character/381679	宇宙人たち. Character in Space Dandy
381680	Maboroshi no Ramen-ya no Oyaji	Q80447738	https://anilist.co/character/381680	幻のラーメン屋のオヤジ. Character in Space Dandy
381681	Candy	Q80447738	https://anilist.co/character/381681	キャンディ. Character in Space Dandy
381682	Andro Seijin	Q80447738	https://anilist.co/character/381682	アンドロ星人. Character in Space Dandy
381683	Menya Galaxy Tenin	Q80447738	https://anilist.co/character/381683	麺屋ギャラクシー店員. Character in Space Dandy
381684	Taiin	Q80447738	https://anilist.co/character/381684	隊員. Character in Space Dandy
381685	Mamitas	Q80447738	https://anilist.co/character/381685	マミタス. Character in Space Dandy
381688	Dai-7 Kantai Taichou	Q80447738	https://anilist.co/character/381688	第7艦隊隊長. Character in Space Dandy
381689	Raagi Seijin A	Q80447738	https://anilist.co/character/381689	ラーギ星人A. Character in Space Dandy
381690	Raagi Seijin B	Q80447738	https://anilist.co/character/381690	ラーギ星人B. Character in Space Dandy
381691	Senpai Uchuujin	Q80447738	https://anilist.co/character/381691	先輩宇宙人. Character in Space Dandy
381692	Nurse A	Q80447738	https://anilist.co/character/381692	ナースA. Character in Space Dandy
381693	Nurse B	Q80447738	https://anilist.co/character/381693	ナースB. Character in Space Dandy
381694	Isha	Q80447738	https://anilist.co/character/381694	医者. Character in Space Dandy
381695	Youhei A	Q80447738	https://anilist.co/character/381695	傭兵A. Character in Space Dandy
381696	Youhei B	Q80447738	https://anilist.co/character/381696	傭兵B. Character in Space Dandy
381697	Ojii-chan	Q80447738	https://anilist.co/character/381697	おじいちゃん. Character in Space Dandy
381698	Waitress	Q80447738	https://anilist.co/character/381698	ウェイトレス. Character in Space Dandy
381699	Hostess	Q80447738	https://anilist.co/character/381699	ホステス. Character in Space Dandy
381700	Hunter A	Q80447738	https://anilist.co/character/381700	ハンターA. Character in Space Dandy
381701	Hunter B	Q80447738	https://anilist.co/character/381701	ハンターB. Character in Space Dandy
381702	Pantsu Seijin	Q80447738	https://anilist.co/character/381702	パンツ星人. Character in Space Dandy
381703	Chokki Seijin	Q80447738	https://anilist.co/character/381703	チョッキ星人. Character in Space Dandy