id	name	type	url	P4086	description
21164	Buta no Gotoki Sanzoku ni Torawarete Shojo wo Ubawareru Kyonyuu Himekishi & Onna Senshi: Zettai Chi●po Nanka ni Maketari Shinai!! THE ANIMATION	Q220898	https://anilist.co/anime/21164	28169	豚の如き山賊に捕らわれて処女を奪われる巨乳姫騎士&女戦士 ~絶対チ●ポなんかに負けたりしない!!~ THE ANIMATION. 2015 anime by Seven
21616	Gakuen no Ikenie: Nagusami Mono to Kashita Kyonyuu Furyou Shoujo ~Hakudaku ni Okasareru Kasshoku & Daniku no Kyouen~ THE ANIMATION	Q220898	https://anilist.co/anime/21616	30658	学園の生贄――慰み者と化した巨乳不良少女～白濁に侵される褐色＆堕肉の狂宴～ THE ANIMATION. 2015 anime by Office Takeout
107138	WATATEN!: an Angel Flew Down to Me: You Never Let Us Down / Always Growing Closer / Let's Change You Into This! / I'm Your Big Sister	Q220898	https://anilist.co/anime/107138	38999	私に天使が舞い降りた！OVA. 2019 anime by Doga Kobo
122758	Hi☆sCoool! SeHa Girl: Dai-54-Kai Hanpa Jano! Zenryoku de Guu! Youshou Suru no wa Only You! Subete no Gakkou Gyouji o Kako ni Suru! SeHaGaga Gakuen Taiikusai	Q220898	https://anilist.co/anime/122758	34323	Hi☆sCoool! セハガール: 第54回 ハンパじゃノー！全力でグー！優勝するのはオンリーユー！すべての学校行事を過去にする！セハガガ学園体育祭. 2016 anime by Sega Games. Directed by Souta Sugahara
145759	Kochira Katsushikaku Kameari Kouenmae Hashutsujo Special: Uwasa no Kaipan Deka Toujou / Buchou yo! Are ga Paris no Hi da / Gekitotsu! Kami VS Ryoutsu	Q1107	https://anilist.co/anime/145759		こちら葛飾区亀有公園前派出所スペシャル 噂の海パン刑事登場／部長よ！あれがパリの灯だ／激突！神VS両津. 1997 anime
145781	Kochira Katsushikaku Kameari Kouenmae Hashutsujo Special: Seton Tankentai! Sumidagawa no Chikai - Omoide no Shiroi Kujira wo Sagase!	Q1107	https://anilist.co/anime/145781	33879	こちら葛飾区亀有公園前派出所スペシャル シートン探検隊！隅田川の誓い～思い出の白い鯨を探せ！. 2007 anime
170822	Mukuwarenakatta Murabito A, Kizoku ni Hirowarete Dekiai sareru Ue ni, Jitsu wa Motteita Densetsu-kyuu no Kami Skill mo Kakusei shita	Q63952888	https://anilist.co/anime/170822	57005	報われなかった村人A、貴族に拾われて溺愛される上に、実は持っていた伝説級の神スキルも覚醒した. anime by l-a-unch・BOX. Directed by Masahiko Komino
195703	"99-kai Danzai sareta Loop Reijou desu ga Konse wa ""Chouzetsu Aisare Mode"" desu tte!? Shin no Chikara ni Mezamete Hajimaru 100-kaime no Jinsei"		https://anilist.co/anime/195703	62002	99回断罪されたループ令嬢ですが今世は「超絶愛されモード」ですって!? 〜真の力に目覚めて始まる100回目の人生〜. anime
201514	Saijo no Osewa: Takane no Hanadarake na Meimonkou de, Gakuin Ichi no Ojou-sama (Seikatsu Nouryoku Kaimu) wo Kagenagara Osewa suru Koto ni Narimashita	Q63952888	https://anilist.co/anime/201514	62876	才女のお世話 高嶺の花だらけな名門校で、学院一のお嬢様(生活能力皆無)を陰ながらお世話することになりました. 2026 anime by Brain's Base. Directed by Shuusei Morishita
202251	Kanchigai no Atelier Meister: Eiyuu Party no Moto Zatsuyougakari ga, Jitsu wa Sentou Igai ga SSS Rank Datta to Iu Yoku Aru Hanashi 2nd Season		https://anilist.co/anime/202251	62924	勘違いの工房主～英雄パーティの元雑用係が、実は戦闘以外がSSSランクだったというよくある話～第2期. anime
203129	Akutou Ikka no Manamusume, Tensei-saki mo Otome Game no Gokudou Reijou deshita.: Saijoukyuu Ranku no Akuyaku-sama, Sono Dekiai wa Fuyou desu!		https://anilist.co/anime/203129		悪党一家の愛娘、転生先も乙女ゲームの極道令嬢でした。～最上級ランクの悪役さま、その溺愛は不要です！～. anime
207329	"Tsuihou sareta Cheat Fuyo Majutsushi wa Kimama na Second Life wo Ouka suru.: Ore wa Buki dake ja Naku, Arayuru Mono ni ""Kyouka Point"" wo Fuyo Dekiru shi, Ore no Ishi de Itsudemo Kouka wo Kaijo Dekiru kedo, Nokotta Hitotachi Daijoubu?"	Q63952888	https://anilist.co/anime/207329	63431	追放されたチート付与魔術師は気ままなセカンドライフを謳歌する。 ～俺は武器だけじゃなく、あらゆるものに『強化ポイント』を付与できるし、俺の意思でいつでも効果を解除できるけど、残った人たち大丈夫？～. anime by P.A.WORKS
211473	Napolitan no Yoru	Q1047299	https://anilist.co/anime/211473		ナポリタンの夜. 2014 anime. Directed by Yuusuke Sakamoto
211479	KIRA	Q64100970	https://anilist.co/anime/211479	64047	綺羅. 2026 anime by KIKO. Directed by Nao Watanabe
211495	Boushoku no Berserk 2nd Season	Q100269041	https://anilist.co/anime/211495	64059	暴食のベルセルク第2期. anime
211496	Kagurabachi	Q63952888	https://anilist.co/anime/211496	64058	カグラバチ. 2027 anime by Cypic. Directed by Tetsuya Takeuchi
211538	Hokuhokusei ni Kumo to Ike	Q63952888	https://anilist.co/anime/211538	64064	北北西に曇と往け. anime
211557	Furachi	Q113687694	https://anilist.co/anime/211557	64070	フラチ. 2026 anime by T-REX
211607	Jujutsu Kaisen Modulo PV	Q1107	https://anilist.co/anime/211607		呪術廻戦≡ PV. 2026 anime by MAPPA. Directed by Shun Miyakawa
211709	Go-toubun no Hanayome: Shunkashuutou	Q63952888	https://anilist.co/anime/211709	64104	五等分の花嫁【春夏秋冬】. anime
211710	Go-toubun no Hanayome (Shinsaku OVA)	Q220898	https://anilist.co/anime/211710	64105	五等分の花嫁 新作OVA. anime
211711	Boku no Hero Academia: I am a hero too	Q1107	https://anilist.co/anime/211711	64107	僕のヒーローアカデミア I am a hero too. 2026 anime
211778	Sekai Saikyou no Majo, Hajimemashita	Q63952888	https://anilist.co/anime/211778	64084	世界最強の魔女、始めました. 2026 anime by Bridge and Aisle. Directed by Jouji Furuta
211864	MYSTERIOUS STAR	Q64100970	https://anilist.co/anime/211864		MYSTERIOUS STAR. 2025 anime
211877	Kanojo no Tomodachi	Q63952888	https://anilist.co/anime/211877	64131	彼女の友達. 2026 anime
212092	Breakfast Eggs	Q20650540	https://anilist.co/anime/212092		卵焼きの朝. 2023 anime. Directed by Musashi Yoshihara
212105	Umi ga Hashiru End Roll	Q20650540	https://anilist.co/anime/212105	64154	海が走るエンドロール. 2027 anime by Kyoto Animation. Directed by Taichi Ishidate
212144	Kizu darake Seijo yori Houfuku wo Komete Season2	Q100269041	https://anilist.co/anime/212144		傷だらけ聖女より報復をこめて Season2. 2026 anime by Imageworks Studio and Imagica Infos
212272	Deco x Deco THE ANIMATION	Q220898	https://anilist.co/anime/212272		デコ×デコ THE ANIMATION. 2026 anime by Seven. Directed by Naoya Hitomi